Gene_set,Term,Overlap,P-value,Adjusted P-value,Old P-value,Old Adjusted P-value,Odds Ratio,Combined Score,Genes
GO_Biological_Process_2021,respiratory chain complex IV assembly (GO:0008535),1/23,0.1089472978360328,0.2539666316446224,0,0,9.1267217630854,20.232947516534363,COA1
GO_Biological_Process_2021,positive regulation of natural killer cell mediated immunity (GO:0002717),1/23,0.1089472978360328,0.2539666316446224,0,0,9.1267217630854,20.232947516534363,CD226
GO_Biological_Process_2021,"nuclear-transcribed mRNA catabolic process, nonsense-mediated decay (GO:0000184)",2/113,0.109762052329387,0.2552285233076178,0,0,3.638352638352639,8.038723369904124,CASC3;SMG5
GO_Biological_Process_2021,response to lipid (GO:0033993),2/114,0.1113729080000625,0.2552285233076178,0,0,3.6056851311953353,7.914014366919983,CTNNB1;OVCA2
GO_Biological_Process_2021,histone modification (GO:0016570),2/114,0.1113729080000625,0.2552285233076178,0,0,3.6056851311953353,7.914014366919983,SIRT2;HDAC6
GO_Biological_Process_2021,regulation of cardiac muscle hypertrophy (GO:0010611),1/24,0.113407683581024,0.2552285233076178,0,0,8.729468599033817,19.002011610155247,NOTCH1
GO_Biological_Process_2021,negative regulation of ossification (GO:0030279),1/24,0.113407683581024,0.2552285233076178,0,0,8.729468599033817,19.002011610155247,NOTCH1
GO_Biological_Process_2021,negative regulation of protein tyrosine kinase activity (GO:0061099),1/24,0.113407683581024,0.2552285233076178,0,0,8.729468599033817,19.002011610155247,MVP
GO_Biological_Process_2021,cellular response to catecholamine stimulus (GO:0071870),1/24,0.113407683581024,0.2552285233076178,0,0,8.729468599033817,19.002011610155247,SIRT2
GO_Biological_Process_2021,"nucleotide-excision repair, DNA gap filling (GO:0006297)",1/24,0.113407683581024,0.2552285233076178,0,0,8.729468599033817,19.002011610155247,LIG1
GO_Biological_Process_2021,porphyrin-containing compound biosynthetic process (GO:0006779),1/24,0.113407683581024,0.2552285233076178,0,0,8.729468599033817,19.002011610155247,ABCB10
GO_Biological_Process_2021,heterochromatin assembly (GO:0031507),1/24,0.113407683581024,0.2552285233076178,0,0,8.729468599033817,19.002011610155247,SIRT2
GO_Biological_Process_2021,immune response-activating cell surface receptor signaling pathway (GO:0002429),1/24,0.113407683581024,0.2552285233076178,0,0,8.729468599033817,19.002011610155247,SPG21
GO_Biological_Process_2021,positive regulation of neuron apoptotic process (GO:0043525),1/24,0.113407683581024,0.2552285233076178,0,0,8.729468599033817,19.002011610155247,CTNNB1
GO_Biological_Process_2021,leukotriene metabolic process (GO:0006691),1/24,0.113407683581024,0.2552285233076178,0,0,8.729468599033817,19.002011610155247,MGST3
GO_Biological_Process_2021,positive regulation of transcription from RNA polymerase II promoter in response to stress (GO:0036003),1/24,0.113407683581024,0.2552285233076178,0,0,8.729468599033817,19.002011610155247,NOTCH1
GO_Biological_Process_2021,protein kinase B signaling (GO:0043491),1/24,0.113407683581024,0.2552285233076178,0,0,8.729468599033817,19.002011610155247,SIRT2
GO_Biological_Process_2021,ncRNA 3'-end processing (GO:0043628),1/24,0.113407683581024,0.2552285233076178,0,0,8.729468599033817,19.002011610155247,INTS5
GO_Biological_Process_2021,3'-phosphoadenosine 5'-phosphosulfate metabolic process (GO:0050427),1/25,0.1178459640404217,0.2607827133680105,0,0,8.365319865319865,17.88820673407011,SULT1A1
GO_Biological_Process_2021,protein quality control for misfolded or incompletely synthesized proteins (GO:0006515),1/25,0.1178459640404217,0.2607827133680105,0,0,8.365319865319865,17.88820673407011,HDAC6
GO_Biological_Process_2021,negative regulation of endocytosis (GO:0045806),1/25,0.1178459640404217,0.2607827133680105,0,0,8.365319865319865,17.88820673407011,UNC119
GO_Biological_Process_2021,regulation of calcium ion import (GO:0090279),1/25,0.1178459640404217,0.2607827133680105,0,0,8.365319865319865,17.88820673407011,CTNNB1
GO_Biological_Process_2021,regulation of mitochondrial fission (GO:0090140),1/25,0.1178459640404217,0.2607827133680105,0,0,8.365319865319865,17.88820673407011,MAPT
GO_Biological_Process_2021,regulation of myotube differentiation (GO:0010830),1/25,0.1178459640404217,0.2607827133680105,0,0,8.365319865319865,17.88820673407011,NOTCH1
GO_Biological_Process_2021,response to hexose (GO:0009746),1/25,0.1178459640404217,0.2607827133680105,0,0,8.365319865319865,17.88820673407011,EIF2B5
GO_Biological_Process_2021,regulation of cellular response to stress (GO:0080135),2/118,0.1178777907834289,0.2607827133680105,0,0,3.480647431386348,7.441996159064892,NUP42;MAPT
GO_Biological_Process_2021,positive regulation of cysteine-type endopeptidase activity involved in apoptotic process (GO:0043280),2/119,0.1195188772922953,0.2610599631743305,0,0,3.450723879295308,7.330307004338375,TRADD;MAPT
GO_Biological_Process_2021,macroautophagy (GO:0016236),2/120,0.1211657133256166,0.2610599631743305,0,0,3.4213075060532687,7.220998411655919,ATG101;VPS33A
GO_Biological_Process_2021,negative regulation of cell population proliferation (GO:0008285),4/379,0.1221485410147971,0.2610599631743305,0,0,2.1694444444444443,4.561294748227306,NOTCH1;FTH1;CTNNB1;SIRT2
GO_Biological_Process_2021,negative regulation of cell development (GO:0010721),1/26,0.1222622476286691,0.2610599631743305,0,0,8.030303030303031,16.876380218002918,NOTCH1
GO_Biological_Process_2021,regulation of biomineral tissue development (GO:0070167),1/26,0.1222622476286691,0.2610599631743305,0,0,8.030303030303031,16.876380218002918,NOTCH1
GO_Biological_Process_2021,negative regulation of receptor-mediated endocytosis (GO:0048261),1/26,0.1222622476286691,0.2610599631743305,0,0,8.030303030303031,16.876380218002918,UNC119
GO_Biological_Process_2021,chaperone cofactor-dependent protein refolding (GO:0051085),1/26,0.1222622476286691,0.2610599631743305,0,0,8.030303030303031,16.876380218002918,SDF2
GO_Biological_Process_2021,organelle fission (GO:0048285),1/26,0.1222622476286691,0.2610599631743305,0,0,8.030303030303031,16.876380218002918,MTFR2
GO_Biological_Process_2021,regulation of myelination (GO:0031641),1/26,0.1222622476286691,0.2610599631743305,0,0,8.030303030303031,16.876380218002918,SIRT2
GO_Biological_Process_2021,DNA modification (GO:0006304),1/26,0.1222622476286691,0.2610599631743305,0,0,8.030303030303031,16.876380218002918,EXOSC6
GO_Biological_Process_2021,regulation of telomere maintenance (GO:0032204),1/26,0.1222622476286691,0.2610599631743305,0,0,8.030303030303031,16.876380218002918,SMG5
GO_Biological_Process_2021,glial cell development (GO:0021782),1/26,0.1222622476286691,0.2610599631743305,0,0,8.030303030303031,16.876380218002918,EIF2B5
GO_Biological_Process_2021,positive regulation of histone methylation (GO:0031062),1/26,0.1222622476286691,0.2610599631743305,0,0,8.030303030303031,16.876380218002918,CTNNB1
GO_Biological_Process_2021,histone lysine demethylation (GO:0070076),1/26,0.1222622476286691,0.2610599631743305,0,0,8.030303030303031,16.876380218002918,KDM3A
GO_Biological_Process_2021,positive regulation of microtubule polymerization or depolymerization (GO:0031112),1/26,0.1222622476286691,0.2610599631743305,0,0,8.030303030303031,16.876380218002918,MAPT
GO_Biological_Process_2021,snRNA processing (GO:0016180),1/26,0.1222622476286691,0.2610599631743305,0,0,8.030303030303031,16.876380218002918,INTS5
GO_Biological_Process_2021,maturation of LSU-rRNA (GO:0000470),1/26,0.1222622476286691,0.2610599631743305,0,0,8.030303030303031,16.876380218002918,RPF1
GO_Biological_Process_2021,positive regulation of DNA-binding transcription factor activity (GO:0051091),3/246,0.1255875097595958,0.2639524425590907,0,0,2.501845488099784,5.190710117207115,ANXA3;TRADD;CTNNB1
GO_Biological_Process_2021,regulation of anatomical structure morphogenesis (GO:0022603),2/123,0.1261397529272332,0.2639524425590907,0,0,3.335975712599089,6.906686810673667,CTNNB1;MAPT
GO_Biological_Process_2021,cellular response to organic substance (GO:0071310),2/123,0.1261397529272332,0.2639524425590907,0,0,3.335975712599089,6.906686810673667,CTNNB1;HDAC6
GO_Biological_Process_2021,cellular lipid catabolic process (GO:0044242),1/27,0.1266566423028266,0.2639524425590907,0,0,7.721056721056721,15.953830010816358,SIRT2
GO_Biological_Process_2021,cellular response to unfolded protein (GO:0034620),1/27,0.1266566423028266,0.2639524425590907,0,0,7.721056721056721,15.953830010816358,ABCB10
GO_Biological_Process_2021,positive regulation of BMP signaling pathway (GO:0030513),1/27,0.1266566423028266,0.2639524425590907,0,0,7.721056721056721,15.953830010816358,NOTCH1
GO_Biological_Process_2021,regulation of vasculature development (GO:1901342),1/27,0.1266566423028266,0.2639524425590907,0,0,7.721056721056721,15.953830010816358,CTNNB1
GO_Biological_Process_2021,positive regulation of erythrocyte differentiation (GO:0045648),1/27,0.1266566423028266,0.2639524425590907,0,0,7.721056721056721,15.953830010816358,ABCB10
GO_Biological_Process_2021,positive regulation of muscle cell differentiation (GO:0051149),1/27,0.1266566423028266,0.2639524425590907,0,0,7.721056721056721,15.953830010816358,CTNNB1
GO_Biological_Process_2021,positive regulation of nuclear division (GO:0051785),1/27,0.1266566423028266,0.2639524425590907,0,0,7.721056721056721,15.953830010816358,SIRT2
GO_Biological_Process_2021,microtubule polymerization or depolymerization (GO:0031109),1/27,0.1266566423028266,0.2639524425590907,0,0,7.721056721056721,15.953830010816358,MAPT
GO_Biological_Process_2021,protein export from nucleus (GO:0006611),1/27,0.1266566423028266,0.2639524425590907,0,0,7.721056721056721,15.953830010816358,NUP42
GO_Biological_Process_2021,protein targeting (GO:0006605),2/125,0.1294827706147527,0.2651116196533011,0,0,3.281400365024058,6.707863079636441,ARL6;SEC63
GO_Biological_Process_2021,cellular response to oxidative stress (GO:0034599),2/125,0.1294827706147527,0.2651116196533011,0,0,3.281400365024058,6.707863079636441,MAPT;SIRT2
GO_Biological_Process_2021,regulation of phosphorylation (GO:0042325),2/125,0.1294827706147527,0.2651116196533011,0,0,3.281400365024058,6.707863079636441,NUP42;SIRT2
GO_Biological_Process_2021,regulation of B cell activation (GO:0050864),1/28,0.1310292553948657,0.2651116196533011,0,0,7.434717545828657,15.109834134055738,IGLL1
GO_Biological_Process_2021,regulation of calcium-mediated signaling (GO:0050848),1/28,0.1310292553948657,0.2651116196533011,0,0,7.434717545828657,15.109834134055738,MAPT
GO_Biological_Process_2021,cristae formation (GO:0042407),1/28,0.1310292553948657,0.2651116196533011,0,0,7.434717545828657,15.109834134055738,ATP5ME
GO_Biological_Process_2021,regulation of microtubule polymerization or depolymerization (GO:0031110),1/28,0.1310292553948657,0.2651116196533011,0,0,7.434717545828657,15.109834134055738,MAPT
GO_Biological_Process_2021,regulation of protein transport (GO:0051223),1/28,0.1310292553948657,0.2651116196533011,0,0,7.434717545828657,15.109834134055738,LLGL1
GO_Biological_Process_2021,glycogen metabolic process (GO:0005977),1/28,0.1310292553948657,0.2651116196533011,0,0,7.434717545828657,15.109834134055738,GAA
GO_Biological_Process_2021,RNA phosphodiester bond hydrolysis (GO:0090501),1/28,0.1310292553948657,0.2651116196533011,0,0,7.434717545828657,15.109834134055738,KHNYN
GO_Biological_Process_2021,positive regulation of microtubule polymerization (GO:0031116),1/28,0.1310292553948657,0.2651116196533011,0,0,7.434717545828657,15.109834134055738,MAPT
GO_Biological_Process_2021,leukocyte cell-cell adhesion (GO:0007159),1/28,0.1310292553948657,0.2651116196533011,0,0,7.434717545828657,15.109834134055738,GFUS
GO_Biological_Process_2021,ventricular septum morphogenesis (GO:0060412),1/28,0.1310292553948657,0.2651116196533011,0,0,7.434717545828657,15.109834134055738,NOTCH1
GO_Biological_Process_2021,protein localization to cell surface (GO:0034394),1/28,0.1310292553948657,0.2651116196533011,0,0,7.434717545828657,15.109834134055738,CTNNB1
GO_Biological_Process_2021,protein localization to lysosome (GO:0061462),1/28,0.1310292553948657,0.2651116196533011,0,0,7.434717545828657,15.109834134055738,GCC2
GO_Biological_Process_2021,positive regulation of signal transduction (GO:0009967),3/252,0.1322873238446812,0.2671383555158097,0,0,2.4408148056142096,4.937228995568672,NOTCH1;CD226;NOTCH2NLC
GO_Biological_Process_2021,aggrephagy (GO:0035973),1/29,0.13538019382269,0.2680982791960096,0,0,7.1688311688311686,14.335283778329618,HDAC6
GO_Biological_Process_2021,beta-catenin-TCF complex assembly (GO:1904837),1/29,0.13538019382269,0.2680982791960096,0,0,7.1688311688311686,14.335283778329618,CTNNB1
GO_Biological_Process_2021,regulation of DNA biosynthetic process (GO:2000278),1/29,0.13538019382269,0.2680982791960096,0,0,7.1688311688311686,14.335283778329618,SMG5
GO_Biological_Process_2021,regulation of fatty acid biosynthetic process (GO:0042304),1/29,0.13538019382269,0.2680982791960096,0,0,7.1688311688311686,14.335283778329618,ERLIN1
GO_Biological_Process_2021,negative regulation of transferase activity (GO:0051348),1/29,0.13538019382269,0.2680982791960096,0,0,7.1688311688311686,14.335283778329618,MAPT
GO_Biological_Process_2021,glial cell differentiation (GO:0010001),1/29,0.13538019382269,0.2680982791960096,0,0,7.1688311688311686,14.335283778329618,EIF2B5
GO_Biological_Process_2021,lipid catabolic process (GO:0016042),1/29,0.13538019382269,0.2680982791960096,0,0,7.1688311688311686,14.335283778329618,SIRT2
GO_Biological_Process_2021,mismatch repair (GO:0006298),1/29,0.13538019382269,0.2680982791960096,0,0,7.1688311688311686,14.335283778329618,LIG1
GO_Biological_Process_2021,protein ADP-ribosylation (GO:0006471),1/29,0.13538019382269,0.2680982791960096,0,0,7.1688311688311686,14.335283778329618,SIRT2
GO_Biological_Process_2021,protein K11-linked ubiquitination (GO:0070979),1/29,0.13538019382269,0.2680982791960096,0,0,7.1688311688311686,14.335283778329618,UBE2T
GO_Biological_Process_2021,G2/M transition of mitotic cell cycle (GO:0000086),2/130,0.1379293598318549,0.2680982791960096,0,0,3.152423469387755,6.244993797842871,HAUS5;HAUS2
GO_Biological_Process_2021,Golgi organization (GO:0007030),2/130,0.1379293598318549,0.2680982791960096,0,0,3.152423469387755,6.244993797842871,COG1;GCC2
GO_Biological_Process_2021,negative regulation of cellular macromolecule biosynthetic process (GO:2000113),5/547,0.1391749951172699,0.2680982791960096,0,0,1.8797824820353464,3.706974627924026,NOTCH1;CTNNB1;SAMD1;SIRT2;HDAC6
GO_Biological_Process_2021,cell cycle G2/M phase transition (GO:0044839),2/131,0.1396332156913081,0.2680982791960096,0,0,3.127827875336181,6.157867909881721,HAUS5;HAUS2
GO_Biological_Process_2021,artery morphogenesis (GO:0048844),1/30,0.1397095639188418,0.2680982791960096,0,0,6.921281783350749,13.622394510819325,NOTCH1
GO_Biological_Process_2021,regulation of natural killer cell mediated cytotoxicity (GO:0042269),1/30,0.1397095639188418,0.2680982791960096,0,0,6.921281783350749,13.622394510819325,CD226
GO_Biological_Process_2021,plasma membrane invagination (GO:0099024),1/30,0.1397095639188418,0.2680982791960096,0,0,6.921281783350749,13.622394510819325,IGLL1
GO_Biological_Process_2021,establishment of spindle orientation (GO:0051294),1/30,0.1397095639188418,0.2680982791960096,0,0,6.921281783350749,13.622394510819325,LLGL1
GO_Biological_Process_2021,estrogen metabolic process (GO:0008210),1/30,0.1397095639188418,0.2680982791960096,0,0,6.921281783350749,13.622394510819325,SULT1A1
GO_Biological_Process_2021,extrinsic apoptotic signaling pathway via death domain receptors (GO:0008625),1/30,0.1397095639188418,0.2680982791960096,0,0,6.921281783350749,13.622394510819325,TRADD
GO_Biological_Process_2021,Golgi to plasma membrane protein transport (GO:0043001),1/30,0.1397095639188418,0.2680982791960096,0,0,6.921281783350749,13.622394510819325,GCC2
GO_Biological_Process_2021,"maturation of SSU-rRNA from tricistronic rRNA transcript (SSU-rRNA, 5.8S rRNA, LSU-rRNA) (GO:0000462)",1/30,0.1397095639188418,0.2680982791960096,0,0,6.921281783350749,13.622394510819325,NOP9
GO_Biological_Process_2021,termination of RNA polymerase I transcription (GO:0006363),1/30,0.1397095639188418,0.2680982791960096,0,0,6.921281783350749,13.622394510819325,TTF1
GO_Biological_Process_2021,positive regulation of small GTPase mediated signal transduction (GO:0051057),1/30,0.1397095639188418,0.2680982791960096,0,0,6.921281783350749,13.622394510819325,NOTCH1
GO_Biological_Process_2021,microtubule polymerization (GO:0046785),1/30,0.1397095639188418,0.2680982791960096,0,0,6.921281783350749,13.622394510819325,MAPT
GO_Biological_Process_2021,morphogenesis of an epithelium (GO:0002009),1/30,0.1397095639188418,0.2680982791960096,0,0,6.921281783350749,13.622394510819325,PRKX
GO_Biological_Process_2021,ncRNA catabolic process (GO:0034661),1/30,0.1397095639188418,0.2680982791960096,0,0,6.921281783350749,13.622394510819325,EXOSC6
GO_Biological_Process_2021,regulation of cell adhesion (GO:0030155),2/133,0.1430547538373086,0.2723524597175432,0,0,3.07976320299112,5.988685251990531,PRKX;PIK3CG
GO_Biological_Process_2021,'de novo' posttranslational protein folding (GO:0051084),1/31,0.1440174715013112,0.2723524597175432,0,0,6.69023569023569,12.964476920040203,SDF2
GO_Biological_Process_2021,negative regulation of osteoblast differentiation (GO:0045668),1/31,0.1440174715013112,0.2723524597175432,0,0,6.69023569023569,12.964476920040203,NOTCH1
GO_Biological_Process_2021,negative regulation of peptidyl-tyrosine phosphorylation (GO:0050732),1/31,0.1440174715013112,0.2723524597175432,0,0,6.69023569023569,12.964476920040203,MVP
GO_Biological_Process_2021,negative regulation of response to biotic stimulus (GO:0002832),1/31,0.1440174715013112,0.2723524597175432,0,0,6.69023569023569,12.964476920040203,SIRT2
GO_Biological_Process_2021,organelle transport along microtubule (GO:0072384),1/31,0.1440174715013112,0.2723524597175432,0,0,6.69023569023569,12.964476920040203,MAPT
GO_Biological_Process_2021,peptide cross-linking (GO:0018149),1/31,0.1440174715013112,0.2723524597175432,0,0,6.69023569023569,12.964476920040203,CD3G
GO_Biological_Process_2021,protein acetylation (GO:0006473),1/31,0.1440174715013112,0.2723524597175432,0,0,6.69023569023569,12.964476920040203,MAPT
GO_Biological_Process_2021,negative regulation of chemotaxis (GO:0050922),1/32,0.1483040219339779,0.2764450641416905,0,0,6.474095796676441,12.355752978101908,NOTCH1
GO_Biological_Process_2021,aortic valve morphogenesis (GO:0003180),1/32,0.1483040219339779,0.2764450641416905,0,0,6.474095796676441,12.355752978101908,NOTCH1
GO_Biological_Process_2021,regulation of cell migration involved in sprouting angiogenesis (GO:0090049),1/32,0.1483040219339779,0.2764450641416905,0,0,6.474095796676441,12.355752978101908,NOTCH1
GO_Biological_Process_2021,cardiac muscle tissue morphogenesis (GO:0055008),1/32,0.1483040219339779,0.2764450641416905,0,0,6.474095796676441,12.355752978101908,NOTCH1
GO_Biological_Process_2021,cellular response to topologically incorrect protein (GO:0035967),1/32,0.1483040219339779,0.2764450641416905,0,0,6.474095796676441,12.355752978101908,HDAC6
GO_Biological_Process_2021,regulation of intracellular protein transport (GO:0033157),1/32,0.1483040219339779,0.2764450641416905,0,0,6.474095796676441,12.355752978101908,GCC2
GO_Biological_Process_2021,RNA biosynthetic process (GO:0032774),1/32,0.1483040219339779,0.2764450641416905,0,0,6.474095796676441,12.355752978101908,TTF1
GO_Biological_Process_2021,positive regulation of receptor signaling pathway via STAT (GO:1904894),1/32,0.1483040219339779,0.2764450641416905,0,0,6.474095796676441,12.355752978101908,NOTCH1
GO_Biological_Process_2021,positive regulation of cell migration (GO:0030335),3/269,0.1519225071318246,0.2783639450886657,0,0,2.2828462909851948,4.3017606451913055,NOTCH1;TRADD;HDAC6
GO_Biological_Process_2021,neuron projection extension (GO:1990138),1/33,0.152569319997184,0.2783639450886657,0,0,6.271464646464646,11.79120788980768,CTNNB1
GO_Biological_Process_2021,regulation of neurotransmitter secretion (GO:0046928),1/33,0.152569319997184,0.2783639450886657,0,0,6.271464646464646,11.79120788980768,SEPTIN5
GO_Biological_Process_2021,regulation of protein localization to cell surface (GO:2000008),1/33,0.152569319997184,0.2783639450886657,0,0,6.271464646464646,11.79120788980768,CTNNB1
GO_Biological_Process_2021,exonucleolytic catabolism of deadenylated mRNA (GO:0043928),1/33,0.152569319997184,0.2783639450886657,0,0,6.271464646464646,11.79120788980768,EXOSC6
GO_Biological_Process_2021,positive regulation of cytokine production involved in immune response (GO:0002720),1/33,0.152569319997184,0.2783639450886657,0,0,6.271464646464646,11.79120788980768,CD226
GO_Biological_Process_2021,lytic vacuole organization (GO:0080171),1/33,0.152569319997184,0.2783639450886657,0,0,6.271464646464646,11.79120788980768,GAA
GO_Biological_Process_2021,positive regulation of receptor signaling pathway via JAK-STAT (GO:0046427),1/33,0.152569319997184,0.2783639450886657,0,0,6.271464646464646,11.79120788980768,NOTCH1
GO_Biological_Process_2021,positive regulation of telomere maintenance via telomerase (GO:0032212),1/33,0.152569319997184,0.2783639450886657,0,0,6.271464646464646,11.79120788980768,CTNNB1
GO_Biological_Process_2021,vasculogenesis (GO:0001570),1/33,0.152569319997184,0.2783639450886657,0,0,6.271464646464646,11.79120788980768,NOTCH1
GO_Biological_Process_2021,positive regulation of response to external stimulus (GO:0032103),2/139,0.1534237633251,0.2783639450886657,0,0,2.9439892745419334,5.518659484645247,TRADD;ZCCHC3
GO_Biological_Process_2021,neuron projection morphogenesis (GO:0048812),2/140,0.1551662685109655,0.2783639450886657,0,0,2.922508133688258,5.445386768069675,CTNNB1;LLGL1
GO_Biological_Process_2021,cellular protein metabolic process (GO:0044267),4/417,0.1562611209090835,0.2783639450886657,0,0,1.966000807102502,3.6493434244770375,MRPS17;MRPS33;TTF1;MRPL24
GO_Biological_Process_2021,negative regulation of blood vessel endothelial cell migration (GO:0043537),1/34,0.1568134700259566,0.2783639450886657,0,0,6.081114172023263,11.266469699963473,NOTCH1
GO_Biological_Process_2021,negative regulation of extrinsic apoptotic signaling pathway via death domain receptors (GO:1902042),1/34,0.1568134700259566,0.2783639450886657,0,0,6.081114172023263,11.266469699963473,TRADD
GO_Biological_Process_2021,autophagosome maturation (GO:0097352),1/34,0.1568134700259566,0.2783639450886657,0,0,6.081114172023263,11.266469699963473,VPS33A
GO_Biological_Process_2021,B cell receptor signaling pathway (GO:0050853),1/34,0.1568134700259566,0.2783639450886657,0,0,6.081114172023263,11.266469699963473,IGLL1
GO_Biological_Process_2021,regulation of cell adhesion mediated by integrin (GO:0033628),1/34,0.1568134700259566,0.2783639450886657,0,0,6.081114172023263,11.266469699963473,PIK3CG
GO_Biological_Process_2021,negative regulation of mitochondrion organization (GO:0010823),1/34,0.1568134700259566,0.2783639450886657,0,0,6.081114172023263,11.266469699963473,MAPT
GO_Biological_Process_2021,cardiac muscle contraction (GO:0060048),1/34,0.1568134700259566,0.2783639450886657,0,0,6.081114172023263,11.266469699963473,GAA
GO_Biological_Process_2021,cellular response to vascular endothelial growth factor stimulus (GO:0035924),1/34,0.1568134700259566,0.2783639450886657,0,0,6.081114172023263,11.266469699963473,NOTCH1
GO_Biological_Process_2021,regulation of myoblast differentiation (GO:0045661),1/34,0.1568134700259566,0.2783639450886657,0,0,6.081114172023263,11.266469699963473,NOTCH1
GO_Biological_Process_2021,positive regulation of DNA binding (GO:0043388),1/34,0.1568134700259566,0.2783639450886657,0,0,6.081114172023263,11.266469699963473,SIRT2
GO_Biological_Process_2021,transcription by RNA polymerase I (GO:0006360),1/34,0.1568134700259566,0.2783639450886657,0,0,6.081114172023263,11.266469699963473,TTF1
GO_Biological_Process_2021,positive regulation of telomerase activity (GO:0051973),1/34,0.1568134700259566,0.2783639450886657,0,0,6.081114172023263,11.266469699963473,CTNNB1
GO_Biological_Process_2021,tRNA export from nucleus (GO:0006409),1/34,0.1568134700259566,0.2783639450886657,0,0,6.081114172023263,11.266469699963473,NUP42
GO_Biological_Process_2021,tRNA-containing ribonucleoprotein complex export from nucleus (GO:0071431),1/34,0.1568134700259566,0.2783639450886657,0,0,6.081114172023263,11.266469699963473,NUP42
GO_Biological_Process_2021,ventricular cardiac muscle tissue morphogenesis (GO:0055010),1/34,0.1568134700259566,0.2783639450886657,0,0,6.081114172023263,11.266469699963473,NOTCH1
GO_Biological_Process_2021,"base-excision repair, gap-filling (GO:0006287)",1/35,0.1610365757741949,0.2792015173988538,0,0,5.901960784313726,10.777710825180796,LIG1
GO_Biological_Process_2021,negative regulation of neurogenesis (GO:0050768),1/35,0.1610365757741949,0.2792015173988538,0,0,5.901960784313726,10.777710825180796,NOTCH1
GO_Biological_Process_2021,negative regulation of Ras protein signal transduction (GO:0046580),1/35,0.1610365757741949,0.2792015173988538,0,0,5.901960784313726,10.777710825180796,KCTD10
GO_Biological_Process_2021,cellular response to hydrogen peroxide (GO:0070301),1/35,0.1610365757741949,0.2792015173988538,0,0,5.901960784313726,10.777710825180796,HDAC6
GO_Biological_Process_2021,"nuclear-transcribed mRNA catabolic process, exonucleolytic (GO:0000291)",1/35,0.1610365757741949,0.2792015173988538,0,0,5.901960784313726,10.777710825180796,EXOSC6
GO_Biological_Process_2021,regulation of muscle cell differentiation (GO:0051147),1/35,0.1610365757741949,0.2792015173988538,0,0,5.901960784313726,10.777710825180796,CTNNB1
GO_Biological_Process_2021,oxoacid metabolic process (GO:0043436),1/35,0.1610365757741949,0.2792015173988538,0,0,5.901960784313726,10.777710825180796,SULT1A1
