Gene_set,Term,Overlap,P-value,Adjusted P-value,Old P-value,Old Adjusted P-value,Odds Ratio,Combined Score,Genes
GO_Biological_Process_2021,regulation of fibroblast proliferation (GO:0048145),1/46,0.2061310043831236,0.3352231485422516,0,0,4.45679012345679,7.038356248208516,NDUFS4
GO_Biological_Process_2021,establishment of protein localization to extracellular region (GO:0035592),1/46,0.2061310043831236,0.3352231485422516,0,0,4.45679012345679,7.038356248208516,RAB3D
GO_Biological_Process_2021,regulation of telomerase activity (GO:0051972),1/46,0.2061310043831236,0.3352231485422516,0,0,4.45679012345679,7.038356248208516,WRAP53
GO_Biological_Process_2021,interleukin-12-mediated signaling pathway (GO:0035722),1/46,0.2061310043831236,0.3352231485422516,0,0,4.45679012345679,7.038356248208516,GSTO1
GO_Biological_Process_2021,positive regulation of response to stimulus (GO:0048584),1/46,0.2061310043831236,0.3352231485422516,0,0,4.45679012345679,7.038356248208516,TAF9
GO_Biological_Process_2021,cilium assembly (GO:0060271),3/314,0.2077465580416999,0.3372826471735834,0,0,1.948055822587596,3.061245854508761,CEP57;RAB23;DCTN3
GO_Biological_Process_2021,regulation of cellular metabolic process (GO:0031323),1/47,0.2101094941683413,0.3388410206454385,0,0,4.359683794466403,6.801658146757973,NPC2
GO_Biological_Process_2021,polyol metabolic process (GO:0019751),1/47,0.2101094941683413,0.3388410206454385,0,0,4.359683794466403,6.801658146757973,IMPA1
GO_Biological_Process_2021,positive regulation of cell-cell adhesion (GO:0022409),1/47,0.2101094941683413,0.3388410206454385,0,0,4.359683794466403,6.801658146757973,CD47
GO_Biological_Process_2021,regulation of T cell activation (GO:0050863),1/47,0.2101094941683413,0.3388410206454385,0,0,4.359683794466403,6.801658146757973,CD47
GO_Biological_Process_2021,base-excision repair (GO:0006284),1/48,0.2140682440880332,0.3412374980017163,0,0,4.266709649688373,6.576964036635908,LIG1
GO_Biological_Process_2021,cellular response to alcohol (GO:0097306),1/48,0.2140682440880332,0.3412374980017163,0,0,4.266709649688373,6.576964036635908,AKR1C3
GO_Biological_Process_2021,negative regulation of tumor necrosis factor superfamily cytokine production (GO:1903556),1/48,0.2140682440880332,0.3412374980017163,0,0,4.266709649688373,6.576964036635908,LTF
GO_Biological_Process_2021,regulation of interleukin-10 production (GO:0032653),1/48,0.2140682440880332,0.3412374980017163,0,0,4.266709649688373,6.576964036635908,CD47
GO_Biological_Process_2021,nucleus organization (GO:0006997),1/48,0.2140682440880332,0.3412374980017163,0,0,4.266709649688373,6.576964036635908,CHMP1A
GO_Biological_Process_2021,establishment of protein localization to mitochondrion (GO:0072655),1/48,0.2140682440880332,0.3412374980017163,0,0,4.266709649688373,6.576964036635908,TOMM20
GO_Biological_Process_2021,inositol phosphate metabolic process (GO:0043647),1/48,0.2140682440880332,0.3412374980017163,0,0,4.266709649688373,6.576964036635908,IMPA1
GO_Biological_Process_2021,negative regulation of catabolic process (GO:0009895),1/49,0.21800735103248,0.341397049212198,0,0,4.177609427609427,6.363445371866637,TIGAR
GO_Biological_Process_2021,receptor internalization (GO:0031623),1/49,0.21800735103248,0.341397049212198,0,0,4.177609427609427,6.363445371866637,CD81
GO_Biological_Process_2021,cellular defense response (GO:0006968),1/49,0.21800735103248,0.341397049212198,0,0,4.177609427609427,6.363445371866637,RAB23
GO_Biological_Process_2021,cellular response to mechanical stimulus (GO:0071260),1/49,0.21800735103248,0.341397049212198,0,0,4.177609427609427,6.363445371866637,F11R
GO_Biological_Process_2021,regulation of interferon-beta production (GO:0032648),1/49,0.21800735103248,0.341397049212198,0,0,4.177609427609427,6.363445371866637,TRIM56
GO_Biological_Process_2021,response to glucose (GO:0009749),1/49,0.21800735103248,0.341397049212198,0,0,4.177609427609427,6.363445371866637,VAMP2
GO_Biological_Process_2021,response to unfolded protein (GO:0006986),1/49,0.21800735103248,0.341397049212198,0,0,4.177609427609427,6.363445371866637,HSPA2
GO_Biological_Process_2021,secondary alcohol metabolic process (GO:1902652),1/49,0.21800735103248,0.341397049212198,0,0,4.177609427609427,6.363445371866637,FDX1
GO_Biological_Process_2021,positive regulation of reactive oxygen species metabolic process (GO:2000379),1/49,0.21800735103248,0.341397049212198,0,0,4.177609427609427,6.363445371866637,AKR1C3
GO_Biological_Process_2021,mitotic cytokinesis (GO:0000281),1/49,0.21800735103248,0.341397049212198,0,0,4.177609427609427,6.363445371866637,UNC119
GO_Biological_Process_2021,mitochondrion organization (GO:0007005),2/175,0.2180558792587227,0.341397049212198,0,0,2.327120443553144,3.5442135628801488,COX7A2;TOMM20
GO_Biological_Process_2021,cellular response to oxygen-containing compound (GO:1901701),3/323,0.2194378860314134,0.3430048509811413,0,0,1.8923969072164948,2.870172020268605,RAP1A;AKR1C3;LAMTOR2
GO_Biological_Process_2021,glycerophospholipid biosynthetic process (GO:0046474),2/177,0.2217285303247664,0.3441113909587994,0,0,2.3002915451895043,3.464932562997242,IMPA1;CEPT1
GO_Biological_Process_2021,regulation of complement activation (GO:0030449),1/50,0.2219269115603851,0.3441113909587994,0,0,4.092145949288806,6.1603458876211565,CD81
GO_Biological_Process_2021,regulation of generation of precursor metabolites and energy (GO:0043467),1/50,0.2219269115603851,0.3441113909587994,0,0,4.092145949288806,6.1603458876211565,TIGAR
GO_Biological_Process_2021,organic hydroxy compound biosynthetic process (GO:1901617),1/50,0.2219269115603851,0.3441113909587994,0,0,4.092145949288806,6.1603458876211565,AKR1C3
GO_Biological_Process_2021,iron ion transport (GO:0006826),1/50,0.2219269115603851,0.3441113909587994,0,0,4.092145949288806,6.1603458876211565,LTF
GO_Biological_Process_2021,negative regulation of apoptotic process (GO:0043066),4/485,0.224692708898733,0.3451723147470658,0,0,1.6821725571725572,2.511519876113668,UFM1;TAF9;BNIP1;LTF
GO_Biological_Process_2021,protein stabilization (GO:0050821),2/179,0.2254063988806415,0.3451723147470658,0,0,2.274068949613744,3.388022281285932,CCNH;TAF9
GO_Biological_Process_2021,regulation of cellular amine metabolic process (GO:0033238),1/51,0.2258270216564654,0.3451723147470658,0,0,4.01010101010101,5.966974015935645,PSMB6
GO_Biological_Process_2021,regulation of interleukin-12 production (GO:0032655),1/51,0.2258270216564654,0.3451723147470658,0,0,4.01010101010101,5.966974015935645,CD47
GO_Biological_Process_2021,cholesterol transport (GO:0030301),1/51,0.2258270216564654,0.3451723147470658,0,0,4.01010101010101,5.966974015935645,NPC2
GO_Biological_Process_2021,positive regulation of actin filament bundle assembly (GO:0032233),1/51,0.2258270216564654,0.3451723147470658,0,0,4.01010101010101,5.966974015935645,CD47
GO_Biological_Process_2021,mitotic metaphase plate congression (GO:0007080),1/51,0.2258270216564654,0.3451723147470658,0,0,4.01010101010101,5.966974015935645,CHMP1A
GO_Biological_Process_2021,mitotic nuclear membrane organization (GO:0101024),1/51,0.2258270216564654,0.3451723147470658,0,0,4.01010101010101,5.966974015935645,PPP2CA
GO_Biological_Process_2021,mitotic nuclear membrane reassembly (GO:0007084),1/51,0.2258270216564654,0.3451723147470658,0,0,4.01010101010101,5.966974015935645,PPP2CA
GO_Biological_Process_2021,negative regulation of cellular biosynthetic process (GO:0031327),1/52,0.2297077768169888,0.3494452163861594,0,0,3.9312735195088138,5.782696221966044,AKR1C3
GO_Biological_Process_2021,regulation of release of sequestered calcium ion into cytosol (GO:0051279),1/52,0.2297077768169888,0.3494452163861594,0,0,3.9312735195088138,5.782696221966044,GSTO1
GO_Biological_Process_2021,signal transduction in response to DNA damage (GO:0042770),1/52,0.2297077768169888,0.3494452163861594,0,0,3.9312735195088138,5.782696221966044,H2AX
GO_Biological_Process_2021,negative regulation of cysteine-type endopeptidase activity (GO:2000117),1/53,0.233569272224541,0.3514453535341225,0,0,3.8554778554778553,5.606931137649977,LTF
GO_Biological_Process_2021,regulation of DNA replication (GO:0006275),1/53,0.233569272224541,0.3514453535341225,0,0,3.8554778554778553,5.606931137649977,PPP2CA
GO_Biological_Process_2021,regulation of immune effector process (GO:0002697),1/53,0.233569272224541,0.3514453535341225,0,0,3.8554778554778553,5.606931137649977,CD81
GO_Biological_Process_2021,epidermal cell differentiation (GO:0009913),1/53,0.233569272224541,0.3514453535341225,0,0,3.8554778554778553,5.606931137649977,AKR1C3
GO_Biological_Process_2021,positive regulation of B cell activation (GO:0050871),1/53,0.233569272224541,0.3514453535341225,0,0,3.8554778554778553,5.606931137649977,CD81
GO_Biological_Process_2021,IRE1-mediated unfolded protein response (GO:0036498),1/53,0.233569272224541,0.3514453535341225,0,0,3.8554778554778553,5.606931137649977,PDIA5
GO_Biological_Process_2021,positive regulation of phagocytosis (GO:0050766),1/53,0.233569272224541,0.3514453535341225,0,0,3.8554778554778553,5.606931137649977,CD47
GO_Biological_Process_2021,regulation of cellular amino acid metabolic process (GO:0006521),1/54,0.2374116024468537,0.35446616377691,0,0,3.7825424051839143,5.43914439332398,PSMB6
GO_Biological_Process_2021,regulation of cyclin-dependent protein kinase activity (GO:1904029),1/54,0.2374116024468537,0.35446616377691,0,0,3.7825424051839143,5.43914439332398,CCNH
GO_Biological_Process_2021,regulation of humoral immune response (GO:0002920),1/54,0.2374116024468537,0.35446616377691,0,0,3.7825424051839143,5.43914439332398,CD81
GO_Biological_Process_2021,negative regulation of viral genome replication (GO:0045071),1/54,0.2374116024468537,0.35446616377691,0,0,3.7825424051839143,5.43914439332398,LTF
GO_Biological_Process_2021,nuclear membrane reassembly (GO:0031468),1/54,0.2374116024468537,0.35446616377691,0,0,3.7825424051839143,5.43914439332398,PPP2CA
GO_Biological_Process_2021,protein targeting to mitochondrion (GO:0006626),1/55,0.2412348616553018,0.3579614076175446,0,0,3.7123082678638233,5.278844037828421,TOMM20
GO_Biological_Process_2021,regulation of gene silencing by RNA (GO:0060966),1/55,0.2412348616553018,0.3579614076175446,0,0,3.7123082678638233,5.278844037828421,POLR2F
GO_Biological_Process_2021,ceramide metabolic process (GO:0006672),1/55,0.2412348616553018,0.3579614076175446,0,0,3.7123082678638233,5.278844037828421,PPP2CA
GO_Biological_Process_2021,regulation of posttranscriptional gene silencing (GO:0060147),1/55,0.2412348616553018,0.3579614076175446,0,0,3.7123082678638233,5.278844037828421,POLR2F
GO_Biological_Process_2021,regulation of ATP metabolic process (GO:1903578),1/56,0.2450391435680432,0.3613859735675264,0,0,3.644628099173554,5.125576482532065,COX7A2
GO_Biological_Process_2021,autophagosome organization (GO:1905037),1/56,0.2450391435680432,0.3613859735675264,0,0,3.644628099173554,5.125576482532065,RAB23
GO_Biological_Process_2021,sensory organ development (GO:0007423),1/56,0.2450391435680432,0.3613859735675264,0,0,3.644628099173554,5.125576482532065,SH3PXD2B
GO_Biological_Process_2021,mitochondrial transport (GO:0006839),1/56,0.2450391435680432,0.3613859735675264,0,0,3.644628099173554,5.125576482532065,TOMM20
GO_Biological_Process_2021,negative regulation of cell cycle G2/M phase transition (GO:1902750),1/57,0.2488245414130006,0.36418864697721,0,0,3.5793650793650795,4.978922896997587,PSMB6
GO_Biological_Process_2021,negative regulation of DNA recombination (GO:0045910),1/57,0.2488245414130006,0.36418864697721,0,0,3.5793650793650795,4.978922896997587,POLR2F
GO_Biological_Process_2021,arachidonic acid metabolic process (GO:0019369),1/57,0.2488245414130006,0.36418864697721,0,0,3.5793650793650795,4.978922896997587,AKR1C3
GO_Biological_Process_2021,regulation of reactive oxygen species metabolic process (GO:2000377),1/57,0.2488245414130006,0.36418864697721,0,0,3.5793650793650795,4.978922896997587,AKR1C3
GO_Biological_Process_2021,"positive regulation of gene expression, epigenetic (GO:0045815)",1/57,0.2488245414130006,0.36418864697721,0,0,3.5793650793650795,4.978922896997587,POLR2F
GO_Biological_Process_2021,ribosome biogenesis (GO:0042254),2/192,0.2494084860677239,0.3644910704106223,0,0,2.117078410311493,2.939908923064224,NOB1;EXOSC3
GO_Biological_Process_2021,autophagosome assembly (GO:0000045),1/58,0.2525911479606718,0.3652740253443247,0,0,3.5163919900762006,4.8384959983786695,RAB23
GO_Biological_Process_2021,nucleosome assembly (GO:0006334),1/58,0.2525911479606718,0.3652740253443247,0,0,3.5163919900762006,4.8384959983786695,H2AX
GO_Biological_Process_2021,regulation of phagocytosis (GO:0050764),1/58,0.2525911479606718,0.3652740253443247,0,0,3.5163919900762006,4.8384959983786695,CD47
GO_Biological_Process_2021,eye development (GO:0001654),1/58,0.2525911479606718,0.3652740253443247,0,0,3.5163919900762006,4.8384959983786695,SH3PXD2B
GO_Biological_Process_2021,positive regulation of protein binding (GO:0032092),1/58,0.2525911479606718,0.3652740253443247,0,0,3.5163919900762006,4.8384959983786695,PPP2CA
GO_Biological_Process_2021,membrane lipid biosynthetic process (GO:0046467),1/58,0.2525911479606718,0.3652740253443247,0,0,3.5163919900762006,4.8384959983786695,ELOVL4
GO_Biological_Process_2021,muscle organ development (GO:0007517),1/58,0.2525911479606718,0.3652740253443247,0,0,3.5163919900762006,4.8384959983786695,VAMP5
GO_Biological_Process_2021,protein polymerization (GO:0051258),1/59,0.256339055642632,0.3684873924862835,0,0,3.4555903866248694,4.703937185372145,HDGFL3
GO_Biological_Process_2021,phospholipid transport (GO:0015914),1/59,0.256339055642632,0.3684873924862835,0,0,3.4555903866248694,4.703937185372145,NPC2
GO_Biological_Process_2021,response to reactive oxygen species (GO:0000302),1/59,0.256339055642632,0.3684873924862835,0,0,3.4555903866248694,4.703937185372145,AKR1C3
GO_Biological_Process_2021,selective autophagy (GO:0061912),1/59,0.256339055642632,0.3684873924862835,0,0,3.4555903866248694,4.703937185372145,UFM1
GO_Biological_Process_2021,regulation of signal transduction (GO:0009966),2/198,0.2605210865836891,0.3739425997620264,0,0,2.0516451478550604,2.75960936414797,PPP2CA;AKR1C3
GO_Biological_Process_2021,endomembrane system organization (GO:0010256),2/199,0.2623741321223194,0.3758269181477585,0,0,2.0411271107427744,2.7309950255145217,TMED9;BNIP1
GO_Biological_Process_2021,"regulation of DNA-templated transcription, initiation (GO:2000142)",1/61,0.2637791413086752,0.3758269181477585,0,0,3.34006734006734,4.451117734093463,MED20
GO_Biological_Process_2021,regulation of endocytosis (GO:0030100),1/61,0.2637791413086752,0.3758269181477585,0,0,3.34006734006734,4.451117734093463,RAB5B
GO_Biological_Process_2021,positive regulation of DNA biosynthetic process (GO:2000573),1/61,0.2637791413086752,0.3758269181477585,0,0,3.34006734006734,4.451117734093463,WRAP53
GO_Biological_Process_2021,response to light stimulus (GO:0009416),1/61,0.2637791413086752,0.3758269181477585,0,0,3.34006734006734,4.451117734093463,USF1
GO_Biological_Process_2021,ncRNA processing (GO:0034470),2/201,0.2660805999708533,0.3785476576904923,0,0,2.020408163265306,2.6749315277587797,NOB1;EXOSC3
GO_Biological_Process_2021,double-strand break repair via nonhomologous end joining (GO:0006303),1/62,0.2674715018007107,0.379966868734539,0,0,3.285146547441629,4.332261561529935,H2AX
GO_Biological_Process_2021,amyloid fibril formation (GO:1990000),1/63,0.2711455282609312,0.3812613978166805,0,0,3.231997393287716,4.218078497375417,LTF
GO_Biological_Process_2021,negative regulation of endopeptidase activity (GO:0010951),1/63,0.2711455282609312,0.3812613978166805,0,0,3.231997393287716,4.218078497375417,LTF
GO_Biological_Process_2021,cell cycle G1/S phase transition (GO:0044843),1/63,0.2711455282609312,0.3812613978166805,0,0,3.231997393287716,4.218078497375417,CCNH
GO_Biological_Process_2021,cellular response to reactive oxygen species (GO:0034614),1/63,0.2711455282609312,0.3812613978166805,0,0,3.231997393287716,4.218078497375417,AKR1C3
GO_Biological_Process_2021,positive regulation of Ras protein signal transduction (GO:0046579),1/63,0.2711455282609312,0.3812613978166805,0,0,3.231997393287716,4.218078497375417,F11R
GO_Biological_Process_2021,positive regulation of viral process (GO:0048524),1/63,0.2711455282609312,0.3812613978166805,0,0,3.231997393287716,4.218078497375417,POLR2F
GO_Biological_Process_2021,monocarboxylic acid biosynthetic process (GO:0072330),1/63,0.2711455282609312,0.3812613978166805,0,0,3.231997393287716,4.218078497375417,ELOVL4
GO_Biological_Process_2021,protein secretion (GO:0009306),1/64,0.2748013108427819,0.3819540521929889,0,0,3.180535513868848,4.108319823136149,RAB3D
GO_Biological_Process_2021,antimicrobial humoral immune response mediated by antimicrobial peptide (GO:0061844),1/64,0.2748013108427819,0.3819540521929889,0,0,3.180535513868848,4.108319823136149,LTF
GO_Biological_Process_2021,negative regulation of intrinsic apoptotic signaling pathway (GO:2001243),1/64,0.2748013108427819,0.3819540521929889,0,0,3.180535513868848,4.108319823136149,PTTG1IP
GO_Biological_Process_2021,regulation of cellular ketone metabolic process (GO:0010565),1/64,0.2748013108427819,0.3819540521929889,0,0,3.180535513868848,4.108319823136149,PSMB6
GO_Biological_Process_2021,diterpenoid metabolic process (GO:0016101),1/64,0.2748013108427819,0.3819540521929889,0,0,3.180535513868848,4.108319823136149,AKR1C3
GO_Biological_Process_2021,regulation of transcription initiation from RNA polymerase II promoter (GO:0060260),1/64,0.2748013108427819,0.3819540521929889,0,0,3.180535513868848,4.108319823136149,MED20
GO_Biological_Process_2021,lipid homeostasis (GO:0055088),1/64,0.2748013108427819,0.3819540521929889,0,0,3.180535513868848,4.108319823136149,USF1
GO_Biological_Process_2021,pre-replicative complex assembly (GO:0036388),1/64,0.2748013108427819,0.3819540521929889,0,0,3.180535513868848,4.108319823136149,PSMB6
GO_Biological_Process_2021,regulation of inflammatory response (GO:0050727),2/206,0.2753467939262173,0.3821623605355258,0,0,1.9703881552621048,2.5412567098567544,CD47;VAMP2
GO_Biological_Process_2021,chemical homeostasis (GO:0048878),1/65,0.2784389392137884,0.385346726762922,0,0,3.1306818181818183,4.00275356439037,USF1
GO_Biological_Process_2021,steroid biosynthetic process (GO:0006694),1/65,0.2784389392137884,0.385346726762922,0,0,3.1306818181818183,4.00275356439037,AKR1C3
GO_Biological_Process_2021,negative regulation of G2/M transition of mitotic cell cycle (GO:0010972),1/66,0.2820585025763683,0.387029138478369,0,0,3.0823620823620823,3.9011631304837175,PSMB6
GO_Biological_Process_2021,cellular component disassembly (GO:0022411),1/66,0.2820585025763683,0.387029138478369,0,0,3.0823620823620823,3.9011631304837175,SH3PXD2B
GO_Biological_Process_2021,cellular response to nutrient levels (GO:0031669),1/66,0.2820585025763683,0.387029138478369,0,0,3.0823620823620823,3.9011631304837175,AKR1C3
GO_Biological_Process_2021,regulation of protein localization (GO:0032880),1/66,0.2820585025763683,0.387029138478369,0,0,3.0823620823620823,3.9011631304837175,STX10
GO_Biological_Process_2021,extracellular matrix disassembly (GO:0022617),1/66,0.2820585025763683,0.387029138478369,0,0,3.0823620823620823,3.9011631304837175,SH3PXD2B
GO_Biological_Process_2021,positive regulation of cell death (GO:0010942),1/66,0.2820585025763683,0.387029138478369,0,0,3.0823620823620823,3.9011631304837175,AKR1C3
GO_Biological_Process_2021,anion transmembrane transport (GO:0098656),1/67,0.2856600898087258,0.3903078454812294,0,0,3.0355065809611266,3.8033460819667058,PRAF2
GO_Biological_Process_2021,regulation of gene silencing by miRNA (GO:0060964),1/67,0.2856600898087258,0.3903078454812294,0,0,3.0355065809611266,3.8033460819667058,POLR2F
GO_Biological_Process_2021,regulation of viral genome replication (GO:0045069),1/67,0.2856600898087258,0.3903078454812294,0,0,3.0355065809611266,3.8033460819667058,LTF
GO_Biological_Process_2021,phosphate-containing compound metabolic process (GO:0006796),2/212,0.2864598377883567,0.390847744779029,0,0,1.913508260447036,2.392185621773637,TIGAR;IMPA1
GO_Biological_Process_2021,regulation of tyrosine phosphorylation of STAT protein (GO:0042509),1/68,0.2892437892552286,0.3940895633576175,0,0,2.990049751243781,3.709113016933223,PPP2CA
GO_Biological_Process_2021,negative regulation of multicellular organismal process (GO:0051241),2/214,0.2901611340045544,0.3942273634998588,0,0,1.895263765883712,2.345045632168264,PPP2CA;ZNF706
GO_Biological_Process_2021,positive regulation of GTPase activity (GO:0043547),2/214,0.2901611340045544,0.3942273634998588,0,0,1.895263765883712,2.345045632168264,RAP1A;F11R
GO_Biological_Process_2021,cellular response to calcium ion (GO:0071277),1/69,0.2928096888806698,0.3956002230191986,0,0,2.9459298871063577,3.6182865561027495,AKR1C3
GO_Biological_Process_2021,cellular response to decreased oxygen levels (GO:0036294),1/69,0.2928096888806698,0.3956002230191986,0,0,2.9459298871063577,3.6182865561027495,TIGAR
GO_Biological_Process_2021,positive regulation of protein polymerization (GO:0032273),1/69,0.2928096888806698,0.3956002230191986,0,0,2.9459298871063577,3.6182865561027495,ARL2
GO_Biological_Process_2021,positive regulation of protein transport (GO:0051222),1/69,0.2928096888806698,0.3956002230191986,0,0,2.9459298871063577,3.6182865561027495,VAMP2
GO_Biological_Process_2021,extracellular structure organization (GO:0043062),2/216,0.2938603477361359,0.3957544144955557,0,0,1.8773602899103567,2.2991104658975754,CD47;F11R
GO_Biological_Process_2021,regulation of cell growth (GO:0001558),2/217,0.2957090721883371,0.3957544144955557,0,0,1.868533459895586,2.2765822501225608,PPP2CA;LAMTOR2
GO_Biological_Process_2021,external encapsulating structure organization (GO:0045229),2/217,0.2957090721883371,0.3957544144955557,0,0,1.868533459895586,2.2765822501225608,CD47;F11R
GO_Biological_Process_2021,aerobic electron transport chain (GO:0019646),1/70,0.2963578762035246,0.3957544144955557,0,0,2.9030888596105986,3.530700422312052,NDUFS4
GO_Biological_Process_2021,carbohydrate homeostasis (GO:0033500),1/70,0.2963578762035246,0.3957544144955557,0,0,2.9030888596105986,3.530700422312052,USF1
GO_Biological_Process_2021,negative regulation of viral process (GO:0048525),1/70,0.2963578762035246,0.3957544144955557,0,0,2.9030888596105986,3.530700422312052,LTF
GO_Biological_Process_2021,positive regulation of cell-substrate adhesion (GO:0010811),1/70,0.2963578762035246,0.3957544144955557,0,0,2.9030888596105986,3.530700422312052,ARL2
GO_Biological_Process_2021,sterol metabolic process (GO:0016125),1/70,0.2963578762035246,0.3957544144955557,0,0,2.9030888596105986,3.530700422312052,FDX1
GO_Biological_Process_2021,regulation of glycolytic process (GO:0006110),1/71,0.2998884383134025,0.3957544144955557,0,0,2.8614718614718613,3.446198601550195,TIGAR
GO_Biological_Process_2021,regulation of hematopoietic stem cell differentiation (GO:1902036),1/71,0.2998884383134025,0.3957544144955557,0,0,2.8614718614718613,3.446198601550195,PSMB6
GO_Biological_Process_2021,cholesterol homeostasis (GO:0042632),1/71,0.2998884383134025,0.3957544144955557,0,0,2.8614718614718613,3.446198601550195,NPC2
GO_Biological_Process_2021,nucleic acid metabolic process (GO:0090304),1/71,0.2998884383134025,0.3957544144955557,0,0,2.8614718614718613,3.446198601550195,POLR2F
GO_Biological_Process_2021,fatty acid biosynthetic process (GO:0006633),1/71,0.2998884383134025,0.3957544144955557,0,0,2.8614718614718613,3.446198601550195,ELOVL4
GO_Biological_Process_2021,regulation of TOR signaling (GO:0032006),1/71,0.2998884383134025,0.3957544144955557,0,0,2.8614718614718613,3.446198601550195,LAMTOR2
GO_Biological_Process_2021,histone acetylation (GO:0016573),1/71,0.2998884383134025,0.3957544144955557,0,0,2.8614718614718613,3.446198601550195,TAF9
GO_Biological_Process_2021,response to metal ion (GO:0010038),1/71,0.2998884383134025,0.3957544144955557,0,0,2.8614718614718613,3.446198601550195,PPP2CA
GO_Biological_Process_2021,mitochondrial ATP synthesis coupled electron transport (GO:0042775),1/71,0.2998884383134025,0.3957544144955557,0,0,2.8614718614718613,3.446198601550195,NDUFS4
GO_Biological_Process_2021,negative regulation of supramolecular fiber organization (GO:1902904),1/72,0.3034014618596549,0.3987562070155465,0,0,2.821027173139849,3.3646345783285243,HDGFL3
GO_Biological_Process_2021,response to ionizing radiation (GO:0010212),1/72,0.3034014618596549,0.3987562070155465,0,0,2.821027173139849,3.3646345783285243,H2AX
GO_Biological_Process_2021,sterol homeostasis (GO:0055092),1/72,0.3034014618596549,0.3987562070155465,0,0,2.821027173139849,3.3646345783285243,NPC2
GO_Biological_Process_2021,"antigen processing and presentation of exogenous peptide antigen via MHC class I, TAP-dependent (GO:0002479)",1/73,0.3068970331118836,0.3990074481643063,0,0,2.781705948372615,3.2858706369655613,PSMB6
GO_Biological_Process_2021,regulation of actin filament-based process (GO:0032970),1/73,0.3068970331118836,0.3990074481643063,0,0,2.781705948372615,3.2858706369655613,F11R
GO_Biological_Process_2021,chromatin assembly (GO:0031497),1/73,0.3068970331118836,0.3990074481643063,0,0,2.781705948372615,3.2858706369655613,H2AX
GO_Biological_Process_2021,neurotransmitter transport (GO:0006836),1/73,0.3068970331118836,0.3990074481643063,0,0,2.781705948372615,3.2858706369655613,VAMP2
GO_Biological_Process_2021,defense response to Gram-negative bacterium (GO:0050829),1/73,0.3068970331118836,0.3990074481643063,0,0,2.781705948372615,3.2858706369655613,LTF
GO_Biological_Process_2021,regulation of Rho protein signal transduction (GO:0035023),1/73,0.3068970331118836,0.3990074481643063,0,0,2.781705948372615,3.2858706369655613,F11R
GO_Biological_Process_2021,positive regulation of synaptic transmission (GO:0050806),1/73,0.3068970331118836,0.3990074481643063,0,0,2.781705948372615,3.2858706369655613,VAMP2
