Gene_set,Term,Overlap,P-value,Adjusted P-value,Old P-value,Old Adjusted P-value,Odds Ratio,Combined Score,Genes
GO_Biological_Process_2021,positive regulation of fibroblast proliferation (GO:0048146),1/28,0.1310292553948657,0.2828179789906921,0,0,7.434717545828657,15.109834134055738,NDUFS4
GO_Biological_Process_2021,histone mRNA metabolic process (GO:0008334),1/28,0.1310292553948657,0.2828179789906921,0,0,7.434717545828657,15.109834134055738,ERI1
GO_Biological_Process_2021,positive regulation of microtubule polymerization (GO:0031116),1/28,0.1310292553948657,0.2828179789906921,0,0,7.434717545828657,15.109834134055738,ARL2
GO_Biological_Process_2021,L-amino acid transport (GO:0015807),1/28,0.1310292553948657,0.2828179789906921,0,0,7.434717545828657,15.109834134055738,PRAF2
GO_Biological_Process_2021,leukocyte cell-cell adhesion (GO:0007159),1/28,0.1310292553948657,0.2828179789906921,0,0,7.434717545828657,15.109834134055738,F11R
GO_Biological_Process_2021,macromolecule catabolic process (GO:0009057),1/28,0.1310292553948657,0.2828179789906921,0,0,7.434717545828657,15.109834134055738,MVB12A
GO_Biological_Process_2021,mucosal immune response (GO:0002385),1/28,0.1310292553948657,0.2828179789906921,0,0,7.434717545828657,15.109834134055738,LTF
GO_Biological_Process_2021,protein localization to Golgi apparatus (GO:0034067),1/28,0.1310292553948657,0.2828179789906921,0,0,7.434717545828657,15.109834134055738,ARFRP1
GO_Biological_Process_2021,protein localization to lysosome (GO:0061462),1/28,0.1310292553948657,0.2828179789906921,0,0,7.434717545828657,15.109834134055738,CD81
GO_Biological_Process_2021,"RNA splicing, via transesterification reactions with bulged adenosine as nucleophile (GO:0000377)",3/251,0.1311619612710456,0.2828179789906921,0,0,2.4507815098104424,4.978327314286831,LSM7;CD2BP2;POLR2F
GO_Biological_Process_2021,microtubule cytoskeleton organization involved in mitosis (GO:1902850),2/128,0.1345359164474102,0.2867922527033302,0,0,3.202785876255264,6.424545308435403,PMF1;SPC24
GO_Biological_Process_2021,negative regulation of epithelial to mesenchymal transition (GO:0010719),1/29,0.13538019382269,0.2867922527033302,0,0,7.1688311688311686,14.335283778329618,PPP2CA
GO_Biological_Process_2021,regulation of double-strand break repair via nonhomologous end joining (GO:2001032),1/29,0.13538019382269,0.2867922527033302,0,0,7.1688311688311686,14.335283778329618,WRAP53
GO_Biological_Process_2021,"nucleotide-excision repair, preincision complex assembly (GO:0006294)",1/29,0.13538019382269,0.2867922527033302,0,0,7.1688311688311686,14.335283778329618,CCNH
GO_Biological_Process_2021,dicarboxylic acid transport (GO:0006835),1/29,0.13538019382269,0.2867922527033302,0,0,7.1688311688311686,14.335283778329618,PRAF2
GO_Biological_Process_2021,response to cadmium ion (GO:0046686),1/29,0.13538019382269,0.2867922527033302,0,0,7.1688311688311686,14.335283778329618,AKR1C3
GO_Biological_Process_2021,telomere maintenance via telomerase (GO:0007004),1/29,0.13538019382269,0.2867922527033302,0,0,7.1688311688311686,14.335283778329618,WRAP53
GO_Biological_Process_2021,mismatch repair (GO:0006298),1/29,0.13538019382269,0.2867922527033302,0,0,7.1688311688311686,14.335283778329618,LIG1
GO_Biological_Process_2021,cellular response to insulin stimulus (GO:0032869),2/129,0.1362302303723226,0.2871477420119175,0,0,3.177406395629118,6.333870360024791,VAMP2;USF1
GO_Biological_Process_2021,DNA-dependent DNA replication (GO:0006261),2/129,0.1362302303723226,0.2871477420119175,0,0,3.177406395629118,6.333870360024791,PSMB6;GINS2
GO_Biological_Process_2021,cellular response to hypoxia (GO:0071456),2/131,0.1396332156913081,0.2871477420119175,0,0,3.127827875336181,6.157867909881721,PSMB6;TIGAR
GO_Biological_Process_2021,cellular response to metal ion (GO:0071248),2/131,0.1396332156913081,0.2871477420119175,0,0,3.127827875336181,6.157867909881721,TIGAR;AKR1C3
GO_Biological_Process_2021,regulation of protein localization to membrane (GO:1905475),1/30,0.1397095639188418,0.2871477420119175,0,0,6.921281783350749,13.622394510819325,STX8
GO_Biological_Process_2021,positive regulation of B cell proliferation (GO:0030890),1/30,0.1397095639188418,0.2871477420119175,0,0,6.921281783350749,13.622394510819325,CD81
GO_Biological_Process_2021,positive regulation of DNA recombination (GO:0045911),1/30,0.1397095639188418,0.2871477420119175,0,0,6.921281783350749,13.622394510819325,WRAP53
GO_Biological_Process_2021,positive regulation of lipid kinase activity (GO:0090218),1/30,0.1397095639188418,0.2871477420119175,0,0,6.921281783350749,13.622394510819325,CD81
GO_Biological_Process_2021,RNA-dependent DNA biosynthetic process (GO:0006278),1/30,0.1397095639188418,0.2871477420119175,0,0,6.921281783350749,13.622394510819325,WRAP53
GO_Biological_Process_2021,snRNA 3'-end processing (GO:0034472),1/30,0.1397095639188418,0.2871477420119175,0,0,6.921281783350749,13.622394510819325,EXOSC3
GO_Biological_Process_2021,synaptic vesicle cycle (GO:0099504),1/30,0.1397095639188418,0.2871477420119175,0,0,6.921281783350749,13.622394510819325,VAMP2
GO_Biological_Process_2021,maintenance of blood-brain barrier (GO:0035633),1/30,0.1397095639188418,0.2871477420119175,0,0,6.921281783350749,13.622394510819325,F11R
GO_Biological_Process_2021,microtubule polymerization (GO:0046785),1/30,0.1397095639188418,0.2871477420119175,0,0,6.921281783350749,13.622394510819325,HDGFL3
GO_Biological_Process_2021,ncRNA catabolic process (GO:0034661),1/30,0.1397095639188418,0.2871477420119175,0,0,6.921281783350749,13.622394510819325,EXOSC3
GO_Biological_Process_2021,'de novo' posttranslational protein folding (GO:0051084),1/31,0.1440174715013112,0.2886325258719225,0,0,6.69023569023569,12.964476920040203,HSPA2
GO_Biological_Process_2021,negative regulation of peptidyl-tyrosine phosphorylation (GO:0050732),1/31,0.1440174715013112,0.2886325258719225,0,0,6.69023569023569,12.964476920040203,PPP2CA
GO_Biological_Process_2021,negative regulation of proteasomal ubiquitin-dependent protein catabolic process (GO:0032435),1/31,0.1440174715013112,0.2886325258719225,0,0,6.69023569023569,12.964476920040203,TAF9
GO_Biological_Process_2021,cellular response to cAMP (GO:0071320),1/31,0.1440174715013112,0.2886325258719225,0,0,6.69023569023569,12.964476920040203,RAP1A
GO_Biological_Process_2021,negative regulation of response to biotic stimulus (GO:0002832),1/31,0.1440174715013112,0.2886325258719225,0,0,6.69023569023569,12.964476920040203,LTF
GO_Biological_Process_2021,negative regulation of response to DNA damage stimulus (GO:2001021),1/31,0.1440174715013112,0.2886325258719225,0,0,6.69023569023569,12.964476920040203,PTTG1IP
GO_Biological_Process_2021,organelle transport along microtubule (GO:0072384),1/31,0.1440174715013112,0.2886325258719225,0,0,6.69023569023569,12.964476920040203,TMEM201
GO_Biological_Process_2021,phosphatidylethanolamine metabolic process (GO:0046337),1/31,0.1440174715013112,0.2886325258719225,0,0,6.69023569023569,12.964476920040203,CEPT1
GO_Biological_Process_2021,positive regulation of leukocyte cell-cell adhesion (GO:1903039),1/31,0.1440174715013112,0.2886325258719225,0,0,6.69023569023569,12.964476920040203,CD47
GO_Biological_Process_2021,steroid hormone biosynthetic process (GO:0120178),1/31,0.1440174715013112,0.2886325258719225,0,0,6.69023569023569,12.964476920040203,FDX1
GO_Biological_Process_2021,positive regulation of Rho protein signal transduction (GO:0035025),1/31,0.1440174715013112,0.2886325258719225,0,0,6.69023569023569,12.964476920040203,F11R
GO_Biological_Process_2021,prostaglandin metabolic process (GO:0006693),1/31,0.1440174715013112,0.2886325258719225,0,0,6.69023569023569,12.964476920040203,AKR1C3
GO_Biological_Process_2021,positive regulation of peptidyl-tyrosine phosphorylation (GO:0050731),2/134,0.1447722616002044,0.2888340427181908,0,0,3.0562770562770565,5.906540809205433,CD81;UNC119
GO_Biological_Process_2021,organic substance transport (GO:0071702),2/136,0.1482203237770773,0.2888340427181908,0,0,3.010356381358513,5.746937220227204,CHMP1A;VAMP2
GO_Biological_Process_2021,protein transmembrane import into intracellular organelle (GO:0044743),1/32,0.1483040219339779,0.2888340427181908,0,0,6.474095796676441,12.355752978101908,TOMM20
GO_Biological_Process_2021,regulation of cellular amide metabolic process (GO:0034248),1/32,0.1483040219339779,0.2888340427181908,0,0,6.474095796676441,12.355752978101908,TIGAR
GO_Biological_Process_2021,regulation of cellular biosynthetic process (GO:0031326),1/32,0.1483040219339779,0.2888340427181908,0,0,6.474095796676441,12.355752978101908,CD47
GO_Biological_Process_2021,negative regulation of microtubule polymerization or depolymerization (GO:0031111),1/32,0.1483040219339779,0.2888340427181908,0,0,6.474095796676441,12.355752978101908,HDGFL3
GO_Biological_Process_2021,regulation of centrosome duplication (GO:0010824),1/32,0.1483040219339779,0.2888340427181908,0,0,6.474095796676441,12.355752978101908,CHMP1A
GO_Biological_Process_2021,cellular response to topologically incorrect protein (GO:0035967),1/32,0.1483040219339779,0.2888340427181908,0,0,6.474095796676441,12.355752978101908,HSPA2
GO_Biological_Process_2021,regulation of intracellular estrogen receptor signaling pathway (GO:0033146),1/32,0.1483040219339779,0.2888340427181908,0,0,6.474095796676441,12.355752978101908,UFM1
GO_Biological_Process_2021,regulation of intracellular protein transport (GO:0033157),1/32,0.1483040219339779,0.2888340427181908,0,0,6.474095796676441,12.355752978101908,VAMP2
GO_Biological_Process_2021,DNA damage checkpoint signaling (GO:0000077),1/32,0.1483040219339779,0.2888340427181908,0,0,6.474095796676441,12.355752978101908,H2AX
GO_Biological_Process_2021,response to amino acid (GO:0043200),1/32,0.1483040219339779,0.2888340427181908,0,0,6.474095796676441,12.355752978101908,LAMTOR2
GO_Biological_Process_2021,positive regulation of immune effector process (GO:0002699),1/32,0.1483040219339779,0.2888340427181908,0,0,6.474095796676441,12.355752978101908,CD81
GO_Biological_Process_2021,superoxide metabolic process (GO:0006801),1/32,0.1483040219339779,0.2888340427181908,0,0,6.474095796676441,12.355752978101908,SH3PXD2B
GO_Biological_Process_2021,protein deubiquitination (GO:0016579),3/267,0.1495651244370655,0.2907040446804935,0,0,2.300374882849109,4.370766028065756,PSMB6;STAM2;TOMM20
GO_Biological_Process_2021,phosphatidylcholine biosynthetic process (GO:0006656),1/33,0.152569319997184,0.2947639262345596,0,0,6.271464646464646,11.79120788980768,CEPT1
GO_Biological_Process_2021,positive regulation of organelle organization (GO:0010638),1/33,0.152569319997184,0.2947639262345596,0,0,6.271464646464646,11.79120788980768,TMED9
GO_Biological_Process_2021,very long-chain fatty acid metabolic process (GO:0000038),1/33,0.152569319997184,0.2947639262345596,0,0,6.271464646464646,11.79120788980768,ELOVL4
GO_Biological_Process_2021,positive regulation of response to external stimulus (GO:0032103),2/139,0.1534237633251,0.2958230646148634,0,0,2.9439892745419334,5.518659484645247,CD47;USF1
GO_Biological_Process_2021,cellular response to amino acid stimulus (GO:0071230),1/34,0.1568134700259566,0.2993711700495535,0,0,6.081114172023263,11.266469699963473,LAMTOR2
GO_Biological_Process_2021,organelle disassembly (GO:1903008),1/34,0.1568134700259566,0.2993711700495535,0,0,6.081114172023263,11.266469699963473,UFM1
GO_Biological_Process_2021,synaptic vesicle recycling (GO:0036465),1/34,0.1568134700259566,0.2993711700495535,0,0,6.081114172023263,11.266469699963473,VAMP2
GO_Biological_Process_2021,positive regulation of release of sequestered calcium ion into cytosol (GO:0051281),1/34,0.1568134700259566,0.2993711700495535,0,0,6.081114172023263,11.266469699963473,GSTO1
GO_Biological_Process_2021,positive regulation of telomerase activity (GO:0051973),1/34,0.1568134700259566,0.2993711700495535,0,0,6.081114172023263,11.266469699963473,WRAP53
GO_Biological_Process_2021,"mRNA splicing, via spliceosome (GO:0000398)",3/274,0.1578679284441617,0.3007897808226039,0,0,2.240156731464222,4.135321466545218,LSM7;CD2BP2;POLR2F
GO_Biological_Process_2021,protein modification by small protein removal (GO:0070646),3/276,0.1602663457235971,0.3008923253343758,0,0,2.2235187492919453,4.071080917187088,PSMB6;STAM2;TOMM20
GO_Biological_Process_2021,nitrogen compound transport (GO:0071705),2/143,0.1604167144707384,0.3008923253343758,0,0,2.859892893327544,5.233547895270227,CHMP1A;VAMP2
GO_Biological_Process_2021,"base-excision repair, gap-filling (GO:0006287)",1/35,0.1610365757741949,0.3008923253343758,0,0,5.901960784313726,10.777710825180796,LIG1
GO_Biological_Process_2021,negative regulation of organelle assembly (GO:1902116),1/35,0.1610365757741949,0.3008923253343758,0,0,5.901960784313726,10.777710825180796,NBDY
GO_Biological_Process_2021,regulation of mitotic spindle organization (GO:0060236),1/35,0.1610365757741949,0.3008923253343758,0,0,5.901960784313726,10.777710825180796,CHMP1A
GO_Biological_Process_2021,regulation of protein polymerization (GO:0032271),1/35,0.1610365757741949,0.3008923253343758,0,0,5.901960784313726,10.777710825180796,ARL2
GO_Biological_Process_2021,regulation of regulated secretory pathway (GO:1903305),1/35,0.1610365757741949,0.3008923253343758,0,0,5.901960784313726,10.777710825180796,RAB3D
GO_Biological_Process_2021,regulation of T cell receptor signaling pathway (GO:0050856),1/35,0.1610365757741949,0.3008923253343758,0,0,5.901960784313726,10.777710825180796,CD81
GO_Biological_Process_2021,positive regulation of lymphocyte activation (GO:0051251),1/35,0.1610365757741949,0.3008923253343758,0,0,5.901960784313726,10.777710825180796,CD47
GO_Biological_Process_2021,maturation of SSU-rRNA (GO:0030490),1/35,0.1610365757741949,0.3008923253343758,0,0,5.901960784313726,10.777710825180796,NOB1
GO_Biological_Process_2021,negative regulation of cellular protein localization (GO:1903828),1/36,0.165238740567014,0.3040392826433059,0,0,5.733044733044733,10.321566994169176,ANKRD13A
GO_Biological_Process_2021,regulation of receptor internalization (GO:0002090),1/36,0.165238740567014,0.3040392826433059,0,0,5.733044733044733,10.321566994169176,ANKRD13A
GO_Biological_Process_2021,positive regulation of bone mineralization (GO:0030501),1/36,0.165238740567014,0.3040392826433059,0,0,5.733044733044733,10.321566994169176,LTF
GO_Biological_Process_2021,positive regulation of interferon-beta production (GO:0032728),1/36,0.165238740567014,0.3040392826433059,0,0,5.733044733044733,10.321566994169176,TRIM56
GO_Biological_Process_2021,retina homeostasis (GO:0001895),1/36,0.165238740567014,0.3040392826433059,0,0,5.733044733044733,10.321566994169176,LTF
GO_Biological_Process_2021,telomere maintenance via telomere lengthening (GO:0010833),1/36,0.165238740567014,0.3040392826433059,0,0,5.733044733044733,10.321566994169176,WRAP53
GO_Biological_Process_2021,membrane fusion (GO:0061025),1/36,0.165238740567014,0.3040392826433059,0,0,5.733044733044733,10.321566994169176,VAMP2
GO_Biological_Process_2021,transition metal ion transport (GO:0000041),1/36,0.165238740567014,0.3040392826433059,0,0,5.733044733044733,10.321566994169176,LTF
GO_Biological_Process_2021,regulation of mRNA stability (GO:0043488),2/146,0.1656998745819369,0.3043081346885001,0,0,2.799886621315193,5.033012105126492,PSMB6;EXOSC3
GO_Biological_Process_2021,positive regulation of intracellular protein transport (GO:0090316),2/148,0.1692391088589375,0.3076311746165439,0,0,2.761252446183953,4.905206802489739,CD81;VAMP2
GO_Biological_Process_2021,regulation of actin cytoskeleton reorganization (GO:2000249),1/37,0.1694200671801256,0.3076311746165439,0,0,5.57351290684624,9.895070145641316,F11R
GO_Biological_Process_2021,regulation of intracellular steroid hormone receptor signaling pathway (GO:0033143),1/37,0.1694200671801256,0.3076311746165439,0,0,5.57351290684624,9.895070145641316,UFM1
GO_Biological_Process_2021,regulation of transport (GO:0051049),1/37,0.1694200671801256,0.3076311746165439,0,0,5.57351290684624,9.895070145641316,VAMP2
GO_Biological_Process_2021,positive regulation of exocytosis (GO:0045921),1/37,0.1694200671801256,0.3076311746165439,0,0,5.57351290684624,9.895070145641316,RAB3D
GO_Biological_Process_2021,tRNA transport (GO:0051031),1/37,0.1694200671801256,0.3076311746165439,0,0,5.57351290684624,9.895070145641316,TOMM20
GO_Biological_Process_2021,positive regulation of hydrolase activity (GO:0051345),2/149,0.1710136332671059,0.3099421571032352,0,0,2.7423295848951827,4.842986951998436,RAP1A;F11R
GO_Biological_Process_2021,brain development (GO:0007420),2/150,0.1727913280938574,0.3105165102999081,0,0,2.7236624379481524,4.7818540898178,UFM1;NDUFS4
GO_Biological_Process_2021,response to cytokine (GO:0034097),2/150,0.1727913280938574,0.3105165102999081,0,0,2.7236624379481524,4.7818540898178,TAF9;TRIM56
GO_Biological_Process_2021,negative regulation of proteasomal protein catabolic process (GO:1901799),1/38,0.1735806579316256,0.3105165102999081,0,0,5.422604422604422,9.495592558231127,TAF9
GO_Biological_Process_2021,negative regulation of ubiquitin-dependent protein catabolic process (GO:2000059),1/38,0.1735806579316256,0.3105165102999081,0,0,5.422604422604422,9.495592558231127,TAF9
GO_Biological_Process_2021,connective tissue development (GO:0061448),1/38,0.1735806579316256,0.3105165102999081,0,0,5.422604422604422,9.495592558231127,SH3PXD2B
GO_Biological_Process_2021,spliceosomal snRNP assembly (GO:0000387),1/38,0.1735806579316256,0.3105165102999081,0,0,5.422604422604422,9.495592558231127,CD2BP2
GO_Biological_Process_2021,synaptic vesicle endocytosis (GO:0048488),1/38,0.1735806579316256,0.3105165102999081,0,0,5.422604422604422,9.495592558231127,VAMP2
GO_Biological_Process_2021,negative regulation of cellular metabolic process (GO:0031324),1/39,0.1777206145684703,0.3132812293305517,0,0,5.279638490164806,9.12080010262218,ANKRD13A
GO_Biological_Process_2021,regulation of cellular component biogenesis (GO:0044087),1/39,0.1777206145684703,0.3132812293305517,0,0,5.279638490164806,9.12080010262218,RAP1A
GO_Biological_Process_2021,cellular response to ketone (GO:1901655),1/39,0.1777206145684703,0.3132812293305517,0,0,5.279638490164806,9.12080010262218,AKR1C3
GO_Biological_Process_2021,DNA integrity checkpoint signaling (GO:0031570),1/39,0.1777206145684703,0.3132812293305517,0,0,5.279638490164806,9.12080010262218,H2AX
GO_Biological_Process_2021,regulation of protein tyrosine kinase activity (GO:0061097),1/39,0.1777206145684703,0.3132812293305517,0,0,5.279638490164806,9.12080010262218,UNC119
GO_Biological_Process_2021,regulation of T cell differentiation (GO:0045580),1/39,0.1777206145684703,0.3132812293305517,0,0,5.279638490164806,9.12080010262218,CLPTM1
GO_Biological_Process_2021,positive regulation of intracellular transport (GO:0032388),1/39,0.1777206145684703,0.3132812293305517,0,0,5.279638490164806,9.12080010262218,VAMP2
GO_Biological_Process_2021,"mitochondrial electron transport, NADH to ubiquinone (GO:0006120)",1/39,0.1777206145684703,0.3132812293305517,0,0,5.279638490164806,9.12080010262218,NDUFS4
GO_Biological_Process_2021,cellular response to interleukin-1 (GO:0071347),2/155,0.1817247564919734,0.3147983461263242,0,0,2.633986928104575,4.49163798449718,PSMB6;CD47
GO_Biological_Process_2021,negative regulation of ERBB signaling pathway (GO:1901185),1/40,0.1818400384456406,0.3147983461263242,0,0,5.144004144004144,8.768612919919887,STAM2
GO_Biological_Process_2021,carboxylic acid metabolic process (GO:0019752),1/40,0.1818400384456406,0.3147983461263242,0,0,5.144004144004144,8.768612919919887,GSTO1
GO_Biological_Process_2021,regulation of microtubule polymerization (GO:0031113),1/40,0.1818400384456406,0.3147983461263242,0,0,5.144004144004144,8.768612919919887,ARL2
GO_Biological_Process_2021,organic hydroxy compound transport (GO:0015850),1/40,0.1818400384456406,0.3147983461263242,0,0,5.144004144004144,8.768612919919887,NPC2
GO_Biological_Process_2021,regulation of nitric oxide biosynthetic process (GO:0045428),1/40,0.1818400384456406,0.3147983461263242,0,0,5.144004144004144,8.768612919919887,CD47
GO_Biological_Process_2021,positive regulation of cation channel activity (GO:2001259),1/40,0.1818400384456406,0.3147983461263242,0,0,5.144004144004144,8.768612919919887,GSTO1
GO_Biological_Process_2021,positive regulation of double-strand break repair (GO:2000781),1/40,0.1818400384456406,0.3147983461263242,0,0,5.144004144004144,8.768612919919887,WRAP53
GO_Biological_Process_2021,ribosomal small subunit biogenesis (GO:0042274),1/40,0.1818400384456406,0.3147983461263242,0,0,5.144004144004144,8.768612919919887,NOB1
GO_Biological_Process_2021,synaptic vesicle exocytosis (GO:0016079),1/40,0.1818400384456406,0.3147983461263242,0,0,5.144004144004144,8.768612919919887,VAMP2
GO_Biological_Process_2021,mitotic spindle organization (GO:0007052),2/157,0.1853177460113514,0.3184700413212062,0,0,2.599736668861093,4.382332898174394,PMF1;SPC24
GO_Biological_Process_2021,protein methylation (GO:0006479),1/41,0.1859390303366049,0.3184700413212062,0,0,5.015151515151516,8.43717221072756,METTL21A
GO_Biological_Process_2021,regulation of viral transcription (GO:0046782),1/41,0.1859390303366049,0.3184700413212062,0,0,5.015151515151516,8.43717221072756,POLR2F
GO_Biological_Process_2021,keratinocyte differentiation (GO:0030216),1/41,0.1859390303366049,0.3184700413212062,0,0,5.015151515151516,8.43717221072756,AKR1C3
GO_Biological_Process_2021,positive regulation of TOR signaling (GO:0032008),1/41,0.1859390303366049,0.3184700413212062,0,0,5.015151515151516,8.43717221072756,LAMTOR2
GO_Biological_Process_2021,visual system development (GO:0150063),1/41,0.1859390303366049,0.3184700413212062,0,0,5.015151515151516,8.43717221072756,SH3PXD2B
GO_Biological_Process_2021,cellular response to starvation (GO:0009267),2/158,0.1871181588639223,0.3199223742699981,0,0,2.5829408686551543,4.329047629874819,AKR1C3;LAMTOR2
GO_Biological_Process_2021,extracellular matrix organization (GO:0030198),3/300,0.1898680108475254,0.3209040019335261,0,0,2.0413412475268147,3.391537684750659,SH3PXD2B;CD47;F11R
GO_Biological_Process_2021,regulation of double-strand break repair (GO:2000779),1/42,0.1900176905858975,0.3209040019335261,0,0,4.892584380389258,8.124812043283224,WRAP53
GO_Biological_Process_2021,cellular respiration (GO:0045333),1/42,0.1900176905858975,0.3209040019335261,0,0,4.892584380389258,8.124812043283224,NDUFS4
GO_Biological_Process_2021,histone H3 acetylation (GO:0043966),1/42,0.1900176905858975,0.3209040019335261,0,0,4.892584380389258,8.124812043283224,TAF9
GO_Biological_Process_2021,skeletal system morphogenesis (GO:0048705),1/42,0.1900176905858975,0.3209040019335261,0,0,4.892584380389258,8.124812043283224,LTF
GO_Biological_Process_2021,positive regulation of protein tyrosine kinase activity (GO:0061098),1/42,0.1900176905858975,0.3209040019335261,0,0,4.892584380389258,8.124812043283224,UNC119
GO_Biological_Process_2021,mitochondrial gene expression (GO:0140053),1/42,0.1900176905858975,0.3209040019335261,0,0,4.892584380389258,8.124812043283224,MRPS17
GO_Biological_Process_2021,MAPK cascade (GO:0000165),3/303,0.1936649072016851,0.3248038085839535,0,0,2.020618556701031,3.3170997483290443,PSMB6;ARL2;LAMTOR2
GO_Biological_Process_2021,regulation of cell-cell adhesion (GO:0022407),1/43,0.1940761190078197,0.3248038085839535,0,0,4.775853775853776,7.830035336967146,CD47
GO_Biological_Process_2021,regulation of cell-substrate adhesion (GO:0010810),1/43,0.1940761190078197,0.3248038085839535,0,0,4.775853775853776,7.830035336967146,ARL2
GO_Biological_Process_2021,signal release from synapse (GO:0099643),1/43,0.1940761190078197,0.3248038085839535,0,0,4.775853775853776,7.830035336967146,VAMP2
GO_Biological_Process_2021,spermatid development (GO:0007286),1/43,0.1940761190078197,0.3248038085839535,0,0,4.775853775853776,7.830035336967146,CEP57
GO_Biological_Process_2021,rRNA metabolic process (GO:0016072),2/162,0.1943443078276657,0.3248038085839535,0,0,2.517857142857143,4.124561988604351,NOB1;EXOSC3
GO_Biological_Process_2021,antibacterial humoral response (GO:0019731),1/44,0.1981144149654997,0.3265845134072914,0,0,4.664552501761804,7.551493311263548,LTF
GO_Biological_Process_2021,negative regulation of epidermal growth factor receptor signaling pathway (GO:0042059),1/44,0.1981144149654997,0.3265845134072914,0,0,4.664552501761804,7.551493311263548,STAM2
GO_Biological_Process_2021,regulation of endothelial cell apoptotic process (GO:2000351),1/44,0.1981144149654997,0.3265845134072914,0,0,4.664552501761804,7.551493311263548,AKR1C3
GO_Biological_Process_2021,neurotransmitter secretion (GO:0007269),1/44,0.1981144149654997,0.3265845134072914,0,0,4.664552501761804,7.551493311263548,VAMP2
GO_Biological_Process_2021,positive regulation of osteoblast differentiation (GO:0045669),1/44,0.1981144149654997,0.3265845134072914,0,0,4.664552501761804,7.551493311263548,LTF
GO_Biological_Process_2021,positive regulation of stress fiber assembly (GO:0051496),1/44,0.1981144149654997,0.3265845134072914,0,0,4.664552501761804,7.551493311263548,CD47
GO_Biological_Process_2021,mRNA catabolic process (GO:0006402),1/44,0.1981144149654997,0.3265845134072914,0,0,4.664552501761804,7.551493311263548,NBDY
GO_Biological_Process_2021,protein K63-linked ubiquitination (GO:0070534),1/44,0.1981144149654997,0.3265845134072914,0,0,4.664552501761804,7.551493311263548,TRIM56
GO_Biological_Process_2021,chromosome condensation (GO:0030261),1/45,0.2021326772791743,0.3326408283674317,0,0,4.558310376492194,7.287967841732019,CHMP1A
GO_Biological_Process_2021,regulation of B cell proliferation (GO:0030888),1/46,0.2061310043831236,0.3352231485422516,0,0,4.45679012345679,7.038356248208516,CD81
GO_Biological_Process_2021,regulation of double-strand break repair via homologous recombination (GO:0010569),1/46,0.2061310043831236,0.3352231485422516,0,0,4.45679012345679,7.038356248208516,WRAP53
