Gene_set,Term,Overlap,P-value,Adjusted P-value,Old P-value,Old Adjusted P-value,Odds Ratio,Combined Score,Genes
GO_Biological_Process_2021,regulation of protein polymerization (GO:0032271),1/35,0.1610365757741949,0.2792015173988538,0,0,5.901960784313726,10.777710825180796,MAPT
GO_Biological_Process_2021,regulation of regulated secretory pathway (GO:1903305),1/35,0.1610365757741949,0.2792015173988538,0,0,5.901960784313726,10.777710825180796,SEPTIN5
GO_Biological_Process_2021,regulation of T cell receptor signaling pathway (GO:0050856),1/35,0.1610365757741949,0.2792015173988538,0,0,5.901960784313726,10.777710825180796,CD226
GO_Biological_Process_2021,response to exogenous dsRNA (GO:0043330),1/35,0.1610365757741949,0.2792015173988538,0,0,5.901960784313726,10.777710825180796,ZCCHC3
GO_Biological_Process_2021,positive regulation of lymphocyte activation (GO:0051251),1/35,0.1610365757741949,0.2792015173988538,0,0,5.901960784313726,10.777710825180796,IGLL1
GO_Biological_Process_2021,positive regulation of reproductive process (GO:2000243),1/35,0.1610365757741949,0.2792015173988538,0,0,5.901960784313726,10.777710825180796,SIRT2
GO_Biological_Process_2021,protein localization to cilium (GO:0061512),1/35,0.1610365757741949,0.2792015173988538,0,0,5.901960784313726,10.777710825180796,ARL6
GO_Biological_Process_2021,negative regulation of cellular protein localization (GO:1903828),1/36,0.165238740567014,0.2795109864786179,0,0,5.733044733044733,10.321566994169176,MAPT
GO_Biological_Process_2021,aortic valve development (GO:0003176),1/36,0.165238740567014,0.2795109864786179,0,0,5.733044733044733,10.321566994169176,NOTCH1
GO_Biological_Process_2021,regulation of androgen receptor signaling pathway (GO:0060765),1/36,0.165238740567014,0.2795109864786179,0,0,5.733044733044733,10.321566994169176,HDAC6
GO_Biological_Process_2021,negative regulation of fat cell differentiation (GO:0045599),1/36,0.165238740567014,0.2795109864786179,0,0,5.733044733044733,10.321566994169176,SIRT2
GO_Biological_Process_2021,axonal transport (GO:0098930),1/36,0.165238740567014,0.2795109864786179,0,0,5.733044733044733,10.321566994169176,MAPT
GO_Biological_Process_2021,regulation of cardiac muscle contraction (GO:0055117),1/36,0.165238740567014,0.2795109864786179,0,0,5.733044733044733,10.321566994169176,PIK3CG
GO_Biological_Process_2021,cellular response to heat (GO:0034605),1/36,0.165238740567014,0.2795109864786179,0,0,5.733044733044733,10.321566994169176,MAPT
GO_Biological_Process_2021,regulation of ossification (GO:0030278),1/36,0.165238740567014,0.2795109864786179,0,0,5.733044733044733,10.321566994169176,NOTCH1
GO_Biological_Process_2021,embryonic limb morphogenesis (GO:0030326),1/36,0.165238740567014,0.2795109864786179,0,0,5.733044733044733,10.321566994169176,CTNNB1
GO_Biological_Process_2021,platelet aggregation (GO:0070527),1/36,0.165238740567014,0.2795109864786179,0,0,5.733044733044733,10.321566994169176,PIK3CG
GO_Biological_Process_2021,establishment of protein localization to plasma membrane (GO:0061951),1/36,0.165238740567014,0.2795109864786179,0,0,5.733044733044733,10.321566994169176,GCC2
GO_Biological_Process_2021,macrophage activation (GO:0042116),1/36,0.165238740567014,0.2795109864786179,0,0,5.733044733044733,10.321566994169176,MAPT
GO_Biological_Process_2021,transition metal ion transport (GO:0000041),1/36,0.165238740567014,0.2795109864786179,0,0,5.733044733044733,10.321566994169176,FTH1
GO_Biological_Process_2021,positive regulation of telomere maintenance via telomere lengthening (GO:1904358),1/36,0.165238740567014,0.2795109864786179,0,0,5.733044733044733,10.321566994169176,CTNNB1
GO_Biological_Process_2021,"Wnt signaling pathway, calcium modulating pathway (GO:0007223)",1/36,0.165238740567014,0.2795109864786179,0,0,5.733044733044733,10.321566994169176,CTNNB1
GO_Biological_Process_2021,regulation of erythrocyte differentiation (GO:0045646),1/37,0.1694200671801256,0.2815561563025373,0,0,5.57351290684624,9.895070145641316,ABCB10
GO_Biological_Process_2021,regulation of intracellular pH (GO:0051453),1/37,0.1694200671801256,0.2815561563025373,0,0,5.57351290684624,9.895070145641316,VPS33A
GO_Biological_Process_2021,regulation of intracellular steroid hormone receptor signaling pathway (GO:0033143),1/37,0.1694200671801256,0.2815561563025373,0,0,5.57351290684624,9.895070145641316,HDAC6
GO_Biological_Process_2021,regulation of microtubule cytoskeleton organization (GO:0070507),1/37,0.1694200671801256,0.2815561563025373,0,0,5.57351290684624,9.895070145641316,MAPT
GO_Biological_Process_2021,"phagocytosis, engulfment (GO:0006911)",1/37,0.1694200671801256,0.2815561563025373,0,0,5.57351290684624,9.895070145641316,IGLL1
GO_Biological_Process_2021,regulation of protein autophosphorylation (GO:0031952),1/37,0.1694200671801256,0.2815561563025373,0,0,5.57351290684624,9.895070145641316,MVP
GO_Biological_Process_2021,regulation of transport (GO:0051049),1/37,0.1694200671801256,0.2815561563025373,0,0,5.57351290684624,9.895070145641316,REEP5
GO_Biological_Process_2021,positive regulation of myeloid cell differentiation (GO:0045639),1/37,0.1694200671801256,0.2815561563025373,0,0,5.57351290684624,9.895070145641316,ABCB10
GO_Biological_Process_2021,positive regulation of signaling receptor activity (GO:2000273),1/37,0.1694200671801256,0.2815561563025373,0,0,5.57351290684624,9.895070145641316,HDAC6
GO_Biological_Process_2021,tRNA transport (GO:0051031),1/37,0.1694200671801256,0.2815561563025373,0,0,5.57351290684624,9.895070145641316,NUP42
GO_Biological_Process_2021,ncRNA metabolic process (GO:0034660),1/37,0.1694200671801256,0.2815561563025373,0,0,5.57351290684624,9.895070145641316,MAPT
GO_Biological_Process_2021,regulation of G2/M transition of mitotic cell cycle (GO:0010389),2/149,0.1710136332671059,0.2837519201661216,0,0,2.7423295848951827,4.842986951998436,HAUS5;HAUS2
GO_Biological_Process_2021,positive regulation of programmed cell death (GO:0043068),3/286,0.1724233284901999,0.2848362922279589,0,0,2.1438563258169103,3.768476253215153,TRADD;CTNNB1;HDAC6
GO_Biological_Process_2021,negative regulation of endothelial cell migration (GO:0010596),1/38,0.1735806579316256,0.2848362922279589,0,0,5.422604422604422,9.495592558231127,NOTCH1
GO_Biological_Process_2021,regulation of axon extension (GO:0030516),1/38,0.1735806579316256,0.2848362922279589,0,0,5.422604422604422,9.495592558231127,MAPT
GO_Biological_Process_2021,response to estradiol (GO:0032355),1/38,0.1735806579316256,0.2848362922279589,0,0,5.422604422604422,9.495592558231127,CTNNB1
GO_Biological_Process_2021,lymphocyte proliferation (GO:0046651),1/38,0.1735806579316256,0.2848362922279589,0,0,5.422604422604422,9.495592558231127,PIK3CG
GO_Biological_Process_2021,ventricular septum development (GO:0003281),1/38,0.1735806579316256,0.2848362922279589,0,0,5.422604422604422,9.495592558231127,NOTCH1
GO_Biological_Process_2021,ncRNA export from nucleus (GO:0097064),1/38,0.1735806579316256,0.2848362922279589,0,0,5.422604422604422,9.495592558231127,NUP42
GO_Biological_Process_2021,negative regulation of protein phosphorylation (GO:0001933),2/152,0.1763559296827952,0.2866639015175636,0,0,2.687074829931973,4.662749281288076,MVP;SIRT2
GO_Biological_Process_2021,protein monoubiquitination (GO:0006513),1/39,0.1777206145684703,0.2866639015175636,0,0,5.279638490164806,9.12080010262218,UBE2T
GO_Biological_Process_2021,negative regulation of cellular metabolic process (GO:0031324),1/39,0.1777206145684703,0.2866639015175636,0,0,5.279638490164806,9.12080010262218,SIRT2
GO_Biological_Process_2021,regulation of cellular component biogenesis (GO:0044087),1/39,0.1777206145684703,0.2866639015175636,0,0,5.279638490164806,9.12080010262218,NOTCH1
GO_Biological_Process_2021,regulation of exit from mitosis (GO:0007096),1/39,0.1777206145684703,0.2866639015175636,0,0,5.279638490164806,9.12080010262218,SIRT2
GO_Biological_Process_2021,negative regulation of secretion by cell (GO:1903531),1/39,0.1777206145684703,0.2866639015175636,0,0,5.279638490164806,9.12080010262218,NOTCH1
GO_Biological_Process_2021,regulation of intracellular transport (GO:0032386),1/39,0.1777206145684703,0.2866639015175636,0,0,5.279638490164806,9.12080010262218,REEP5
GO_Biological_Process_2021,regulation of peptidyl-threonine phosphorylation (GO:0010799),1/39,0.1777206145684703,0.2866639015175636,0,0,5.279638490164806,9.12080010262218,SIRT2
GO_Biological_Process_2021,endothelial cell migration (GO:0043542),1/39,0.1777206145684703,0.2866639015175636,0,0,5.279638490164806,9.12080010262218,PRKX
GO_Biological_Process_2021,regulation of T cell differentiation (GO:0045580),1/39,0.1777206145684703,0.2866639015175636,0,0,5.279638490164806,9.12080010262218,CLPTM1
GO_Biological_Process_2021,response to peptide (GO:1901652),1/39,0.1777206145684703,0.2866639015175636,0,0,5.279638490164806,9.12080010262218,EIF2B5
GO_Biological_Process_2021,negative regulation of cell-substrate adhesion (GO:0010812),1/40,0.1818400384456406,0.2919527273657282,0,0,5.144004144004144,8.768612919919887,NOTCH1
GO_Biological_Process_2021,negative regulation of ERBB signaling pathway (GO:1901185),1/40,0.1818400384456406,0.2919527273657282,0,0,5.144004144004144,8.768612919919887,MVP
GO_Biological_Process_2021,regulation of microtubule polymerization (GO:0031113),1/40,0.1818400384456406,0.2919527273657282,0,0,5.144004144004144,8.768612919919887,MAPT
GO_Biological_Process_2021,regulation of cell population proliferation (GO:0042127),6/764,0.1834843230933125,0.2941394840972794,0,0,1.6119126480660193,2.733201072953604,NOTCH1;FTH1;CTNNB1;SHCBP1;SIRT2;RAB33B
GO_Biological_Process_2021,negative regulation of cell-cell adhesion (GO:0022408),1/41,0.1859390303366049,0.2944505617184533,0,0,5.015151515151516,8.43717221072756,NOTCH1
GO_Biological_Process_2021,regulation of cell development (GO:0060284),1/41,0.1859390303366049,0.2944505617184533,0,0,5.015151515151516,8.43717221072756,CTNNB1
GO_Biological_Process_2021,cortical cytoskeleton organization (GO:0030865),1/41,0.1859390303366049,0.2944505617184533,0,0,5.015151515151516,8.43717221072756,LLGL1
GO_Biological_Process_2021,regulation of mitochondrial membrane potential (GO:0051881),1/41,0.1859390303366049,0.2944505617184533,0,0,5.015151515151516,8.43717221072756,MAPT
GO_Biological_Process_2021,epithelial cell migration (GO:0010631),1/41,0.1859390303366049,0.2944505617184533,0,0,5.015151515151516,8.43717221072756,PRKX
GO_Biological_Process_2021,regulation of response to DNA damage stimulus (GO:2001020),1/41,0.1859390303366049,0.2944505617184533,0,0,5.015151515151516,8.43717221072756,MAPT
GO_Biological_Process_2021,heart contraction (GO:0060047),1/41,0.1859390303366049,0.2944505617184533,0,0,5.015151515151516,8.43717221072756,GAA
GO_Biological_Process_2021,hexose metabolic process (GO:0019318),1/41,0.1859390303366049,0.2944505617184533,0,0,5.015151515151516,8.43717221072756,GAA
GO_Biological_Process_2021,T cell receptor signaling pathway (GO:0050852),2/158,0.1871181588639223,0.2958681662157922,0,0,2.5829408686551543,4.329047629874819,EIF2B5;CD3G
GO_Biological_Process_2021,negative regulation of protein catabolic process (GO:0042177),1/42,0.1900176905858975,0.2972949453310888,0,0,4.892584380389258,8.124812043283224,SIRT2
GO_Biological_Process_2021,cellular respiration (GO:0045333),1/42,0.1900176905858975,0.2972949453310888,0,0,4.892584380389258,8.124812043283224,MTFR2
GO_Biological_Process_2021,regulation of extrinsic apoptotic signaling pathway via death domain receptors (GO:1902041),1/42,0.1900176905858975,0.2972949453310888,0,0,4.892584380389258,8.124812043283224,TRADD
GO_Biological_Process_2021,phosphatidylinositol phosphate biosynthetic process (GO:0046854),1/42,0.1900176905858975,0.2972949453310888,0,0,4.892584380389258,8.124812043283224,PIK3CG
GO_Biological_Process_2021,skeletal system morphogenesis (GO:0048705),1/42,0.1900176905858975,0.2972949453310888,0,0,4.892584380389258,8.124812043283224,RAB33B
GO_Biological_Process_2021,positive regulation of protein tyrosine kinase activity (GO:0061098),1/42,0.1900176905858975,0.2972949453310888,0,0,4.892584380389258,8.124812043283224,UNC119
GO_Biological_Process_2021,mitochondrial gene expression (GO:0140053),1/42,0.1900176905858975,0.2972949453310888,0,0,4.892584380389258,8.124812043283224,MRPS17
GO_Biological_Process_2021,regulation of carbohydrate catabolic process (GO:0043470),1/43,0.1940761190078197,0.3000405281990329,0,0,4.775853775853776,7.830035336967146,NUP42
GO_Biological_Process_2021,regulation of cell-substrate adhesion (GO:0010810),1/43,0.1940761190078197,0.3000405281990329,0,0,4.775853775853776,7.830035336967146,NOTCH1
GO_Biological_Process_2021,negative regulation of proteolysis (GO:0045861),1/43,0.1940761190078197,0.3000405281990329,0,0,4.775853775853776,7.830035336967146,HDAC6
GO_Biological_Process_2021,regulation of purine nucleotide metabolic process (GO:1900542),1/43,0.1940761190078197,0.3000405281990329,0,0,4.775853775853776,7.830035336967146,NUP42
GO_Biological_Process_2021,positive regulation of axonogenesis (GO:0050772),1/43,0.1940761190078197,0.3000405281990329,0,0,4.775853775853776,7.830035336967146,MAPT
GO_Biological_Process_2021,heart looping (GO:0001947),1/43,0.1940761190078197,0.3000405281990329,0,0,4.775853775853776,7.830035336967146,NOTCH1
GO_Biological_Process_2021,positive regulation of leukocyte mediated cytotoxicity (GO:0001912),1/43,0.1940761190078197,0.3000405281990329,0,0,4.775853775853776,7.830035336967146,CD226
GO_Biological_Process_2021,substantia nigra development (GO:0021762),1/43,0.1940761190078197,0.3000405281990329,0,0,4.775853775853776,7.830035336967146,SIRT2
GO_Biological_Process_2021,negative regulation of epidermal growth factor receptor signaling pathway (GO:0042059),1/44,0.1981144149654997,0.3013652852467894,0,0,4.664552501761804,7.551493311263548,MVP
GO_Biological_Process_2021,branching morphogenesis of an epithelial tube (GO:0048754),1/44,0.1981144149654997,0.3013652852467894,0,0,4.664552501761804,7.551493311263548,CTNNB1
GO_Biological_Process_2021,cardiac ventricle morphogenesis (GO:0003208),1/44,0.1981144149654997,0.3013652852467894,0,0,4.664552501761804,7.551493311263548,NOTCH1
GO_Biological_Process_2021,neurogenesis (GO:0022008),1/44,0.1981144149654997,0.3013652852467894,0,0,4.664552501761804,7.551493311263548,MAPT
GO_Biological_Process_2021,positive regulation of cell division (GO:0051781),1/44,0.1981144149654997,0.3013652852467894,0,0,4.664552501761804,7.551493311263548,SIRT2
GO_Biological_Process_2021,positive regulation of cell-matrix adhesion (GO:0001954),1/44,0.1981144149654997,0.3013652852467894,0,0,4.664552501761804,7.551493311263548,GFUS
GO_Biological_Process_2021,homotypic cell-cell adhesion (GO:0034109),1/44,0.1981144149654997,0.3013652852467894,0,0,4.664552501761804,7.551493311263548,PIK3CG
GO_Biological_Process_2021,intracellular protein transmembrane transport (GO:0065002),1/44,0.1981144149654997,0.3013652852467894,0,0,4.664552501761804,7.551493311263548,SEC63
GO_Biological_Process_2021,intracellular steroid hormone receptor signaling pathway (GO:0030518),1/44,0.1981144149654997,0.3013652852467894,0,0,4.664552501761804,7.551493311263548,KDM3A
GO_Biological_Process_2021,lymphocyte chemotaxis (GO:0048247),1/44,0.1981144149654997,0.3013652852467894,0,0,4.664552501761804,7.551493311263548,PIK3CG
GO_Biological_Process_2021,protein K63-linked ubiquitination (GO:0070534),1/44,0.1981144149654997,0.3013652852467894,0,0,4.664552501761804,7.551493311263548,UBE2T
GO_Biological_Process_2021,neural crest cell development (GO:0014032),1/45,0.2021326772791743,0.3061369908792146,0,0,4.558310376492194,7.287967841732019,PEF1
GO_Biological_Process_2021,regulation of receptor signaling pathway via JAK-STAT (GO:0046425),1/45,0.2021326772791743,0.3061369908792146,0,0,4.558310376492194,7.287967841732019,NOTCH1
GO_Biological_Process_2021,positive regulation of response to biotic stimulus (GO:0002833),1/45,0.2021326772791743,0.3061369908792146,0,0,4.558310376492194,7.287967841732019,ZCCHC3
GO_Biological_Process_2021,positive regulation of apoptotic process (GO:0043065),3/310,0.2025980581650802,0.306396482740223,0,0,1.9738406259444572,3.151298284847128,TRADD;CTNNB1;SIRT2
GO_Biological_Process_2021,cellular protein-containing complex assembly (GO:0034622),2/168,0.2052495909264702,0.3094935253129897,0,0,2.426112613720187,3.841818525538327,ARL6;MAPT
GO_Biological_Process_2021,regulation of DNA metabolic process (GO:0051052),1/46,0.2061310043831236,0.3094935253129897,0,0,4.45679012345679,7.038356248208516,SMG5
GO_Biological_Process_2021,erythrocyte differentiation (GO:0030218),1/46,0.2061310043831236,0.3094935253129897,0,0,4.45679012345679,7.038356248208516,ABCB10
GO_Biological_Process_2021,establishment of protein localization to extracellular region (GO:0035592),1/46,0.2061310043831236,0.3094935253129897,0,0,4.45679012345679,7.038356248208516,TMEM167A
GO_Biological_Process_2021,regulation of telomerase activity (GO:0051972),1/46,0.2061310043831236,0.3094935253129897,0,0,4.45679012345679,7.038356248208516,CTNNB1
GO_Biological_Process_2021,protein polyubiquitination (GO:0000209),3/314,0.2077465580416999,0.311022864194614,0,0,1.948055822587596,3.061245854508761,ANKRD39;UBE2T;CTNNB1
GO_Biological_Process_2021,cellular macromolecule biosynthetic process (GO:0034645),3/314,0.2077465580416999,0.311022864194614,0,0,1.948055822587596,3.061245854508761,MRPS17;MRPS33;MRPL24
GO_Biological_Process_2021,cell-cell adhesion via plasma-membrane adhesion molecules (GO:0098742),2/170,0.2089002011394475,0.312301305003306,0,0,2.3969873663751216,3.753439275248425,NECTIN4;NECTIN1
GO_Biological_Process_2021,negative regulation of cold-induced thermogenesis (GO:0120163),1/47,0.2101094941683413,0.3123168230005871,0,0,4.359683794466403,6.801658146757973,NOTCH1
GO_Biological_Process_2021,regulation of DNA binding (GO:0051101),1/47,0.2101094941683413,0.3123168230005871,0,0,4.359683794466403,6.801658146757973,SIRT2
GO_Biological_Process_2021,determination of heart left/right asymmetry (GO:0061371),1/47,0.2101094941683413,0.3123168230005871,0,0,4.359683794466403,6.801658146757973,NOTCH1
GO_Biological_Process_2021,embryonic heart tube morphogenesis (GO:0003143),1/47,0.2101094941683413,0.3123168230005871,0,0,4.359683794466403,6.801658146757973,NOTCH1
GO_Biological_Process_2021,base-excision repair (GO:0006284),1/48,0.2140682440880332,0.3168453271871173,0,0,4.266709649688373,6.576964036635908,LIG1
GO_Biological_Process_2021,negative regulation of mitotic cell cycle (GO:0045930),1/48,0.2140682440880332,0.3168453271871173,0,0,4.266709649688373,6.576964036635908,CTNNB1
GO_Biological_Process_2021,cellular response to alcohol (GO:0097306),1/48,0.2140682440880332,0.3168453271871173,0,0,4.266709649688373,6.576964036635908,CTNNB1
GO_Biological_Process_2021,rRNA processing (GO:0006364),2/173,0.2143889182893297,0.3168698622091936,0,0,2.3545769184866927,3.625962602367801,EXOSC6;RPF1
GO_Biological_Process_2021,transcription by RNA polymerase II (GO:0006366),3/320,0.215524998025434,0.3177821345280966,0,0,1.9105987186575173,2.9321545388283345,BTF3;NOTCH1;INTS5
GO_Biological_Process_2021,negative regulation of catabolic process (GO:0009895),1/49,0.21800735103248,0.3177821345280966,0,0,4.177609427609427,6.363445371866637,SIRT2
GO_Biological_Process_2021,regulation of cellular localization (GO:0060341),1/49,0.21800735103248,0.3177821345280966,0,0,4.177609427609427,6.363445371866637,REEP5
GO_Biological_Process_2021,regulation of smooth muscle cell proliferation (GO:0048660),1/49,0.21800735103248,0.3177821345280966,0,0,4.177609427609427,6.363445371866637,CTNNB1
GO_Biological_Process_2021,response to glucose (GO:0009749),1/49,0.21800735103248,0.3177821345280966,0,0,4.177609427609427,6.363445371866637,EIF2B5
GO_Biological_Process_2021,response to hydrogen peroxide (GO:0042542),1/49,0.21800735103248,0.3177821345280966,0,0,4.177609427609427,6.363445371866637,HDAC6
GO_Biological_Process_2021,inner mitochondrial membrane organization (GO:0007007),1/49,0.21800735103248,0.3177821345280966,0,0,4.177609427609427,6.363445371866637,ATP5ME
GO_Biological_Process_2021,positive regulation of reactive oxygen species metabolic process (GO:2000379),1/49,0.21800735103248,0.3177821345280966,0,0,4.177609427609427,6.363445371866637,MAPT
GO_Biological_Process_2021,mitotic cytokinesis (GO:0000281),1/49,0.21800735103248,0.3177821345280966,0,0,4.177609427609427,6.363445371866637,UNC119
GO_Biological_Process_2021,mitochondrion organization (GO:0007005),2/175,0.2180558792587227,0.3177821345280966,0,0,2.327120443553144,3.5442135628801488,MGME1;MTFR2
GO_Biological_Process_2021,defense response to bacterium (GO:0042742),2/176,0.2198915232723461,0.3200097307957887,0,0,2.313628899835797,3.504270756560818,ANXA3;IGLL1
GO_Biological_Process_2021,neutrophil degranulation (GO:0043312),4/481,0.2204568692393294,0.3203850177787745,0,0,1.6966282320055903,2.565392160283399,ANXA3;FTH1;GAA;MVP
GO_Biological_Process_2021,regulation of cellular component movement (GO:0051270),1/50,0.2219269115603851,0.3211775581193351,0,0,4.092145949288806,6.1603458876211565,HDAC6
GO_Biological_Process_2021,regulation of generation of precursor metabolites and energy (GO:0043467),1/50,0.2219269115603851,0.3211775581193351,0,0,4.092145949288806,6.1603458876211565,NUP42
GO_Biological_Process_2021,iron ion transport (GO:0006826),1/50,0.2219269115603851,0.3211775581193351,0,0,4.092145949288806,6.1603458876211565,FTH1
GO_Biological_Process_2021,negative regulation of immune response (GO:0050777),2/178,0.2235668416141477,0.3231021483522079,0,0,2.287105751391466,3.4261869740159687,CD3G;SIRT2
GO_Biological_Process_2021,neutrophil activation involved in immune response (GO:0002283),4/485,0.224692708898733,0.3236750434195832,0,0,1.6821725571725572,2.511519876113668,ANXA3;FTH1;GAA;MVP
GO_Biological_Process_2021,regulation of immune response (GO:0050776),2/179,0.2254063988806415,0.3236750434195832,0,0,2.274068949613744,3.388022281285932,CD3G;CD226
GO_Biological_Process_2021,regulation of epithelial cell migration (GO:0010632),1/51,0.2258270216564654,0.3236750434195832,0,0,4.01010101010101,5.966974015935645,HDAC6
GO_Biological_Process_2021,inositol lipid-mediated signaling (GO:0048017),1/51,0.2258270216564654,0.3236750434195832,0,0,4.01010101010101,5.966974015935645,PIK3CG
GO_Biological_Process_2021,mitotic nuclear membrane organization (GO:0101024),1/51,0.2258270216564654,0.3236750434195832,0,0,4.01010101010101,5.966974015935645,SIRT2
GO_Biological_Process_2021,mitotic nuclear membrane reassembly (GO:0007084),1/51,0.2258270216564654,0.3236750434195832,0,0,4.01010101010101,5.966974015935645,SIRT2
GO_Biological_Process_2021,neutrophil mediated immunity (GO:0002446),4/488,0.227883826307006,0.3252112818523129,0,0,1.671487603305785,2.471995299014235,ANXA3;FTH1;GAA;MVP
GO_Biological_Process_2021,negative regulation of BMP signaling pathway (GO:0030514),1/52,0.2297077768169888,0.3252112818523129,0,0,3.9312735195088138,5.782696221966044,NOTCH1
GO_Biological_Process_2021,negative regulation of cellular biosynthetic process (GO:0031327),1/52,0.2297077768169888,0.3252112818523129,0,0,3.9312735195088138,5.782696221966044,ERLIN1
GO_Biological_Process_2021,negative regulation of protein metabolic process (GO:0051248),1/52,0.2297077768169888,0.3252112818523129,0,0,3.9312735195088138,5.782696221966044,SIRT2
GO_Biological_Process_2021,negative regulation of protein-containing complex assembly (GO:0031333),1/52,0.2297077768169888,0.3252112818523129,0,0,3.9312735195088138,5.782696221966044,HDAC6
GO_Biological_Process_2021,regulation of exocytosis (GO:0017157),1/52,0.2297077768169888,0.3252112818523129,0,0,3.9312735195088138,5.782696221966044,SEPTIN5
GO_Biological_Process_2021,positive regulation of developmental growth (GO:0048639),1/52,0.2297077768169888,0.3252112818523129,0,0,3.9312735195088138,5.782696221966044,MAPT
GO_Biological_Process_2021,response to peptide hormone (GO:0043434),1/52,0.2297077768169888,0.3252112818523129,0,0,3.9312735195088138,5.782696221966044,EIF2B5
GO_Biological_Process_2021,myeloid cell differentiation (GO:0030099),1/52,0.2297077768169888,0.3252112818523129,0,0,3.9312735195088138,5.782696221966044,PRKX
GO_Biological_Process_2021,cardiac muscle tissue development (GO:0048738),1/53,0.233569272224541,0.328004287948749,0,0,3.8554778554778553,5.606931137649977,NOTCH1
GO_Biological_Process_2021,epidermal cell differentiation (GO:0009913),1/53,0.233569272224541,0.328004287948749,0,0,3.8554778554778553,5.606931137649977,CTNNB1
GO_Biological_Process_2021,positive regulation of B cell activation (GO:0050871),1/53,0.233569272224541,0.328004287948749,0,0,3.8554778554778553,5.606931137649977,IGLL1
GO_Biological_Process_2021,heart morphogenesis (GO:0003007),1/53,0.233569272224541,0.328004287948749,0,0,3.8554778554778553,5.606931137649977,NOTCH1
GO_Biological_Process_2021,IRE1-mediated unfolded protein response (GO:0036498),1/53,0.233569272224541,0.328004287948749,0,0,3.8554778554778553,5.606931137649977,PDIA5
GO_Biological_Process_2021,positive regulation of NIK/NF-kappaB signaling (GO:1901224),1/53,0.233569272224541,0.328004287948749,0,0,3.8554778554778553,5.606931137649977,TRADD
GO_Biological_Process_2021,positive regulation of cytokine production (GO:0001819),3/335,0.2352324651440903,0.3298953279678898,0,0,1.8228791454477704,2.638036138247153,CTNNB1;CD226;PIK3CG
GO_Biological_Process_2021,endoplasmic reticulum to Golgi vesicle-mediated transport (GO:0006888),2/185,0.2364667133458621,0.330725788435323,0,0,2.1988401918144307,3.1706128385033825,PEF1;COG1
GO_Biological_Process_2021,nuclear membrane reassembly (GO:0031468),1/54,0.2374116024468537,0.330725788435323,0,0,3.7825424051839143,5.43914439332398,SIRT2
GO_Biological_Process_2021,cytoplasmic microtubule organization (GO:0031122),1/54,0.2374116024468537,0.330725788435323,0,0,3.7825424051839143,5.43914439332398,MAPT
